TransactionNo,Date,ProductNo,ProductName,Price,Quantity,CustomerNo,Country
536544,2018-12-01,21823,Painted Metal Heart With Holly Bell,1.95,2,17544,United Kingdom
536544,2018-12-01,21844,Red Retrospot Mug,2.39,2,17544,United Kingdom
536544,2018-12-01,21851,Lilac Diamante Pen In Gift Box,2.13,1,17544,United Kingdom
536544,2018-12-01,21870,I Can Only Please One Person Mug,2,1,17544,United Kingdom
536544,2018-12-01,21871,Save The Planet Mug,2,5,17544,United Kingdom
536544,2018-12-01,21874,Gin And Tonic Mug,2,1,17544,United Kingdom
536544,2018-12-01,21879,Hearts Gift Tape,1.75,1,17544,United Kingdom
536544,2018-12-01,21884,Cakes And Bows Gift Tape,1.75,1,17544,United Kingdom
536544,2018-12-01,21888,Bingo Set,2.64,1,17544,United Kingdom
536544,2018-12-01,21889,Wooden Box Of Dominoes,1.88,2,17544,United Kingdom
536544,2018-12-01,21892,Traditional Wooden Catch Cup Game,1.88,3,17544,United Kingdom
536544,2018-12-01,21894,Potting Shed Seed Envelopes,1.88,1,17544,United Kingdom
536544,2018-12-01,21911,Garden Metal Sign,2,1,17544,United Kingdom
536544,2018-12-01,21912,Vintage Snakes & Ladders,2.64,3,17544,United Kingdom
536544,2018-12-01,21913,Vintage Seaside Jigsaw Puzzles,2.64,1,17544,United Kingdom
536544,2018-12-01,21914,Blue Harmonica In Box,1.88,3,17544,United Kingdom
536544,2018-12-01,21915,Red Harmonica In Box,1.88,2,17544,United Kingdom
536544,2018-12-01,21922,Union Stripe With Fringe Hammock,4.05,2,17544,United Kingdom
536544,2018-12-01,21928,Jumbo Bag Scandinavian Blue Paisley,2.13,1,17544,United Kingdom
536544,2018-12-01,21935,Suki Shoulder Bag,2,1,17544,United Kingdom
536544,2018-12-01,21942,Skulls Design Flannel,1.75,2,17544,United Kingdom
536544,2018-12-01,21944,Kittens Design Flannel,1.75,1,17544,United Kingdom
536544,2018-12-01,21949,Set Of 6 Strawberry Chopsticks,1.88,1,17544,United Kingdom
536544,2018-12-01,21975,Pack Of 60 Dinosaur Cake Cases,1.69,1,17544,United Kingdom
536544,2018-12-01,21977,Pack Of 60 Pink Paisley Cake Cases,1.69,1,17544,United Kingdom
536544,2018-12-01,21982,Pack Of 12 Suki Tissues,1.63,1,17544,United Kingdom
536544,2018-12-01,21990,Modern Floral Stationery Set,1.88,2,17544,United Kingdom
536544,2018-12-01,21991,Bohemian Collage Stationery Set,1.88,1,17544,United Kingdom
536544,2018-12-01,21992,Vintage Paisley Stationery Set,1.88,6,17544,United Kingdom
536544,2018-12-01,21993,Floral Folk Stationery Set,1.88,4,17544,United Kingdom
536544,2018-12-01,22037,Robot Birthday Card,1.63,1,17544,United Kingdom
536544,2018-12-01,22043,Christmas Card Screen Print,1.56,1,17544,United Kingdom
536544,2018-12-01,22064,Pink Doughnut Trinket Pot,2,1,17544,United Kingdom
536544,2018-12-01,22065,Christmas Pudding Trinket Pot,2,1,17544,United Kingdom
536544,2018-12-01,22067,Choc Truffle Gold Trinket Pot,2,1,17544,United Kingdom
536544,2018-12-01,22068,Black Pirate Treasure Chest,2,1,17544,United Kingdom
536544,2018-12-01,22069,Brown Pirate Treasure Chest,2,1,17544,United Kingdom
536544,2018-12-01,22071,Small White Retrospot Mug In Box,2.64,1,17544,United Kingdom
536544,2018-12-01,22075,6 Ribbons Elegant Christmas,2,1,17544,United Kingdom
536544,2018-12-01,22076,6 Ribbons Empire,2,1,17544,United Kingdom
536544,2018-12-01,22077,6 Ribbons Rustic Charm,2,3,17544,United Kingdom
536544,2018-12-01,22080,Ribbon Reel Polkadots,2,1,17544,United Kingdom
536544,2018-12-01,22081,Ribbon Reel Flora + Fauna,2,1,17544,United Kingdom
536544,2018-12-01,22082,Ribbon Reel Stripes Design,2,1,17544,United Kingdom
536544,2018-12-01,22083,Paper Chain Kit Retrospot,2.39,4,17544,United Kingdom
536544,2018-12-01,22086,Paper Chain Kit 50S Christmas,2.39,33,17544,United Kingdom
536544,2018-12-01,22087,Paper Bunting White Lace,2.39,2,17544,United Kingdom
536544,2018-12-01,22090,Paper Bunting Retrospot,2.39,1,17544,United Kingdom
536544,2018-12-01,22095,Lads Only Tissue Box,1.88,2,17544,United Kingdom
536544,2018-12-01,22100,Skulls Square Tissue Box,1.88,1,17544,United Kingdom
536544,2018-12-01,22107,Pizza Plate In Box,2.64,1,17544,United Kingdom
536544,2018-12-01,22110,Bird House Hot Water Bottle,2.64,2,17544,United Kingdom
536544,2018-12-01,22111,Scottie Dog Hot Water Bottle,3.15,2,17544,United Kingdom
536544,2018-12-01,22112,Chocolate Hot Water Bottle,3.15,2,17544,United Kingdom
536544,2018-12-01,22114,Hot Water Bottle Tea And Sympathy,2.77,3,17544,United Kingdom
536544,2018-12-01,22115,Metal Sign Empire Tea,2.39,2,17544,United Kingdom
536544,2018-12-01,22130,Party Cone Christmas Decoration,2.77,2,17544,United Kingdom
536544,2018-12-01,22134,Mini Ladle Love Heart Red,1.63,1,17544,United Kingdom
536544,2018-12-01,22135,Mini Ladle Love Heart Pink,1.63,5,17544,United Kingdom
536544,2018-12-01,22141,Christmas Craft Tree Top Angel,2.13,4,17544,United Kingdom
536544,2018-12-01,22144,Christmas Craft Little Friends,2.13,4,17544,United Kingdom
536544,2018-12-01,22149,Feltcraft 6 Flower Friends,2.13,1,17544,United Kingdom
536544,2018-12-01,22153,Angel Decoration Stars On Dress,1.63,1,17544,United Kingdom
536544,2018-12-01,22154,Angel Decoration 3 Buttons,1.63,1,17544,United Kingdom
536544,2018-12-01,22155,Star Decoration Rustic,1.63,3,17544,United Kingdom
536544,2018-12-01,22156,Heart Decoration With Pearls,1.75,3,17544,United Kingdom
536544,2018-12-01,22161,Heart Decoration Rustic Hanging,1.62,10,17544,United Kingdom
536544,2018-12-01,22162,Heart Garland Rustic Padded,2,2,17544,United Kingdom
536544,2018-12-01,22169,Family Album White Picture Frame,4.05,1,17544,United Kingdom
536544,2018-12-01,22174,Photo Cube,2,2,17544,United Kingdom
536544,2018-12-01,22178,Victorian Glass Hanging T-Light,1.88,13,17544,United Kingdom
536544,2018-12-01,22182,Cake Stand Victorian Filigree Small,2.13,1,17544,United Kingdom
536544,2018-12-01,22185,Slate Tile Natural Hanging,2,1,17544,United Kingdom
536544,2018-12-01,22189,Cream Heart Card Holder,2.77,1,17544,United Kingdom
536544,2018-12-01,22190,Local Cafe Mug,1.88,3,17544,United Kingdom
536544,2018-12-01,22195,Large Heart Measuring Spoons,2,1,17544,United Kingdom
536544,2018-12-01,22196,Small Heart Measuring Spoons,1.75,2,17544,United Kingdom
536544,2018-12-01,22197,Popcorn Holder,1.75,2,17544,United Kingdom
536544,2018-12-01,22198,Large Popcorn Holder,2,4,17544,United Kingdom
536544,2018-12-01,22203,Milk Pan Red Retrospot,2.64,1,17544,United Kingdom
536544,2018-12-01,22207,Frying Pan Union Flag,2.77,1,17544,United Kingdom
536544,2018-12-01,22219,Lovebird Hanging Decoration White,1.75,3,17544,United Kingdom
536544,2018-12-01,22224,White Lovebird Lantern,2.39,1,17544,United Kingdom
536544,2018-12-01,22265,Easter Decoration Natural Chick,1.69,2,17544,United Kingdom
536544,2018-12-01,22276,Wash Bag Vintage Rose Paisley,2.39,1,17544,United Kingdom
536544,2018-12-01,22294,Heart Filigree Dove Small,1.88,4,17544,United Kingdom
536544,2018-12-01,22296,Heart Ivory Trellis Large,2,1,17544,United Kingdom
536544,2018-12-01,22297,Heart Ivory Trellis Small,1.88,1,17544,United Kingdom
536544,2018-12-01,22299,Pig Keyring With Light & Sound,1.88,1,17544,United Kingdom
536544,2018-12-01,22300,Coffee Mug Dog + Ball Design,2.26,1,17544,United Kingdom
536544,2018-12-01,22301,Coffee Mug Cat + Bird Design,2.26,2,17544,United Kingdom
536544,2018-12-01,22309,Tea Cosy Red Stripe,2.26,1,17544,United Kingdom
536544,2018-12-01,22310,Ivory Knitted Mug Cosy,2,9,17544,United Kingdom
536544,2018-12-01,22314,Office Mug Warmer Choc+Blue,2.39,1,17544,United Kingdom
536544,2018-12-01,22318,Five Heart Hanging Decoration,2.39,1,17544,United Kingdom
536544,2018-12-01,22335,Heart Decoration Painted Zinc,1.69,4,17544,United Kingdom
536544,2018-12-01,22336,Dove Decoration Painted Zinc,1.69,4,17544,United Kingdom
536544,2018-12-01,22345,Party Pizza Dish Blue Polkadot,1.75,1,17544,United Kingdom
536544,2018-12-01,22348,Tea Bag Plate Red Retrospot,1.75,3,17544,United Kingdom
536544,2018-12-01,22355,Charlotte Bag Suki Design,1.75,3,17544,United Kingdom
536544,2018-12-01,22356,Charlotte Bag Pink Polkadot,1.75,9,17544,United Kingdom
536544,2018-12-01,22357,Kings Choice Biscuit Tin,2.77,1,17544,United Kingdom
536544,2018-12-01,22359,Glass Jar Kings Choice,2.39,2,17544,United Kingdom
536544,2018-12-01,22360,Glass Jar English Confectionery,2.39,2,17544,United Kingdom
536544,2018-12-01,22361,Glass Jar Daisy Fresh Cotton Wool,2.39,2,17544,United Kingdom
536544,2018-12-01,22367,Childrens Apron Spaceboy Design,2.13,1,17544,United Kingdom
536544,2018-12-01,22371,Airline Bag Vintage Tokyo 78,2.77,1,17544,United Kingdom
536544,2018-12-01,22375,Airline Bag Vintage Jet Set Brown,2.77,2,17544,United Kingdom
536544,2018-12-01,22376,Airline Bag Vintage Jet Set White,2.77,1,17544,United Kingdom
536544,2018-12-01,22378,Wall Tidy Retrospot,2.13,2,17544,United Kingdom
536544,2018-12-01,22379,Recycling Bag Retrospot,2.13,2,17544,United Kingdom
536544,2018-12-01,22380,Toy Tidy Spaceboy,2.13,1,17544,United Kingdom
536544,2018-12-01,22383,Lunch Bag Suki Design,2.13,1,17544,United Kingdom
536544,2018-12-01,22384,Lunch Bag Pink Polkadot,2.13,2,17544,United Kingdom
536544,2018-12-01,22394,Paperweight Kings Choice,2.26,1,17544,United Kingdom
536544,2018-12-01,22396,Magnets Pack Of 4 Retro Photo,1.88,1,17544,United Kingdom
536544,2018-12-01,22418,10 Colour Spaceboy Pen,1.75,1,17544,United Kingdom
536544,2018-12-01,22419,Lipstick Pen Red,1.63,4,17544,United Kingdom
536544,2018-12-01,22422,Toothpaste Tube Pen,1.69,2,17544,United Kingdom
536544,2018-12-01,22423,Regency Cakestand 3 Tier,3.41,40,17544,United Kingdom
536544,2018-12-01,22430,Enamel Watering Can Cream,3.03,1,17544,United Kingdom
536544,2018-12-01,22432,Watering Can Pink Bunny,2.13,1,17544,United Kingdom
536544,2018-12-01,22437,Set Of 9 Black Skull Balloons,1.75,1,17544,United Kingdom
536544,2018-12-01,22444,Grow Your Own Plant In A Can,1.88,1,17544,United Kingdom
536544,2018-12-01,22451,Silk Purse Babushka Red,2.52,2,17544,United Kingdom
536544,2018-12-01,22457,Natural Slate Heart Chalkboard,2.39,6,17544,United Kingdom
536544,2018-12-01,22469,Heart Of Wicker Small,2,8,17544,United Kingdom
536544,2018-12-01,22470,Heart Of Wicker Large,2.39,1,17544,United Kingdom
536544,2018-12-01,22471,Tv Dinner Tray Air Hostess,3.15,1,17544,United Kingdom
536544,2018-12-01,22476,Empire Union Jack Tv Dinner Tray,3.15,1,17544,United Kingdom
536544,2018-12-01,22477,Watering Can Garden Marker,1.88,2,17544,United Kingdom
536544,2018-12-01,22478,Birdhouse Garden Marker,1.88,1,17544,United Kingdom
536544,2018-12-01,22479,Daisy Garden Marker,1.88,1,17544,United Kingdom
536544,2018-12-01,22487,White Wood Garden Plant Ladder,4.56,1,17544,United Kingdom
536544,2018-12-01,22489,Pack Of 12 Traditional Crayons,1.63,1,17544,United Kingdom
536544,2018-12-01,22494,Emergency First Aid Tin,1.88,2,17544,United Kingdom
536544,2018-12-01,22497,Set Of 2 Tins Vintage Bathroom,2.77,2,17544,United Kingdom
536544,2018-12-01,22515,Childs Garden Spade Pink,2.13,1,17544,United Kingdom
536544,2018-12-01,22517,Childs Garden Rake Pink,2.13,1,17544,United Kingdom
536544,2018-12-01,22519,Childs Garden Brush Pink,2.13,1,17544,United Kingdom
536544,2018-12-01,22530,Magic Drawing Slate Dolly Girl,1.63,5,17544,United Kingdom
536544,2018-12-01,22531,Magic Drawing Slate Circus Parade,1.63,8,17544,United Kingdom
536544,2018-12-01,22539,Mini Jigsaw Dolly Girl,1.63,4,17544,United Kingdom
536544,2018-12-01,22540,Mini Jigsaw Circus Parade,1.63,1,17544,United Kingdom
536544,2018-12-01,22545,Mini Jigsaw Bunnies,1.63,1,17544,United Kingdom
536544,2018-12-01,22548,Heads And Tails Sporting Fun,1.88,1,17544,United Kingdom
536544,2018-12-01,22549,Picture Dominoes,2,1,17544,United Kingdom
536544,2018-12-01,22550,Holiday Fun Ludo,2.64,2,17544,United Kingdom
536544,2018-12-01,22553,Plasters In Tin Skulls,2,1,17544,United Kingdom
536544,2018-12-01,22555,Plasters In Tin Strongman,2,1,17544,United Kingdom
536544,2018-12-01,22558,Clothes Pegs Retrospot Pack 24,1.88,4,17544,United Kingdom
536544,2018-12-01,22560,Traditional Modelling Clay,1.88,1,17544,United Kingdom
536544,2018-12-01,22569,Feltcraft Cushion Butterfly,2.64,1,17544,United Kingdom
536544,2018-12-01,22571,Rocking Horse Red Christmas,1.75,1,17544,United Kingdom
536544,2018-12-01,22573,Star Wooden Christmas Decoration,1.75,5,17544,United Kingdom
536544,2018-12-01,22574,Heart Wooden Christmas Decoration,1.75,1,17544,United Kingdom
536544,2018-12-01,22580,Advent Calendar Gingham Sack,3.28,1,17544,United Kingdom
536544,2018-12-01,22582,Pack Of 6 Sweetie Gift Boxes,2.26,1,17544,United Kingdom
536544,2018-12-01,22583,Pack Of 6 Handbag Gift Boxes,2.26,1,17544,United Kingdom
536544,2018-12-01,22588,Card Holder Gingham Heart,2.26,3,17544,United Kingdom
536544,2018-12-01,22589,Cardholder Gingham Star,2.26,1,17544,United Kingdom
536544,2018-12-01,22595,Gingham Heart Decoration,1.75,1,17544,United Kingdom
536544,2018-12-01,22600,Christmas Retrospot Star Wood,1.75,1,17544,United Kingdom
536544,2018-12-01,22601,Christmas Retrospot Angel Wood,1.75,2,17544,United Kingdom
536544,2018-12-01,22603,Christmas Retrospot Tree Wood,1.75,4,17544,United Kingdom
536544,2018-12-01,22605,Wooden Croquet Garden Set,5.32,1,17544,United Kingdom
536544,2018-12-01,22614,Pack Of 12 Spaceboy Tissues,1.63,1,17544,United Kingdom
536544,2018-12-01,22616,Pack Of 12 London Tissues,1.63,3,17544,United Kingdom
536544,2018-12-01,22620,4 Traditional Spinning Tops,1.88,7,17544,United Kingdom
536544,2018-12-01,22625,Red Kitchen Scales,4.05,2,17544,United Kingdom
536544,2018-12-01,22629,Spaceboy Lunch Box,2.13,1,17544,United Kingdom
536544,2018-12-01,22632,Hand Warmer Red Retrospot,2.13,1,17544,United Kingdom
536544,2018-12-01,22635,Childs Breakfast Set Dolly Girl,4.56,1,17544,United Kingdom
536544,2018-12-01,22639,Set Of 4 Napkin Charms Hearts,2.26,1,17544,United Kingdom
536544,2018-12-01,22644,Ceramic Cherry Cake Money Bank,2,1,17544,United Kingdom
536544,2018-12-01,22645,Ceramic Heart Fairy Cake Money Bank,2,1,17544,United Kingdom
536544,2018-12-01,22646,Ceramic Strawberry Cake Money Bank,2,1,17544,United Kingdom
536544,2018-12-01,22651,Gentleman Shirt Repair Kit,1.75,3,17544,United Kingdom
536544,2018-12-01,22654,Deluxe Sewing Kit,3.28,1,17544,United Kingdom
536544,2018-12-01,22662,Lunch Bag Dolly Girl Design,2.13,2,17544,United Kingdom
536544,2018-12-01,22664,Toy Tidy Dolly Girl Design,2.13,4,17544,United Kingdom
536544,2018-12-01,22665,Recipe Box Blue Sketchbook Design,2.39,1,17544,United Kingdom
536544,2018-12-01,22666,Recipe Box Pantry Yellow Design,2.39,2,17544,United Kingdom
536544,2018-12-01,22669,Red Baby Bunting,2.39,1,17544,United Kingdom
536544,2018-12-01,22675,French Kitchen Sign Blue Metal,1.88,2,17544,United Kingdom
536544,2018-12-01,22694,Wicker Star,2.13,4,17544,United Kingdom
536544,2018-12-01,22695,Wicker Wreath Small,2,2,17544,United Kingdom
536544,2018-12-01,22697,Green Regency Teacup And Saucer,2.39,6,17544,United Kingdom
536544,2018-12-01,22699,Roses Regency Teacup And Saucer,2.39,2,17544,United Kingdom
536544,2018-12-01,22719,Gumball Monochrome Coat Rack,1.88,1,17544,United Kingdom
536544,2018-12-01,22727,Alarm Clock Bakelike Red,2.64,2,17544,United Kingdom
536544,2018-12-01,22728,Alarm Clock Bakelike Pink,2.64,1,17544,United Kingdom
536544,2018-12-01,22729,Alarm Clock Bakelike Orange,2.64,2,17544,United Kingdom
536544,2018-12-01,22730,Alarm Clock Bakelike Ivory,2.64,1,17544,United Kingdom
536544,2018-12-01,22734,Set Of 6 Ribbons Vintage Christmas,2.26,3,17544,United Kingdom
536544,2018-12-01,22737,Ribbon Reel Christmas Present,2,1,17544,United Kingdom
536544,2018-12-01,22738,Ribbon Reel Snowy Village,2,3,17544,United Kingdom
536544,2018-12-01,22739,Ribbon Reel Christmas Sock Bauble,2,1,17544,United Kingdom
536544,2018-12-01,22740,Polkadot Pen,1.75,13,17544,United Kingdom
536544,2018-12-01,22741,Funky Diva Pen,1.75,8,17544,United Kingdom
536544,2018-12-01,22744,Make Your Own Monsoon Card Kit,2.39,1,17544,United Kingdom
536544,2018-12-01,22745,Poppys Playhouse Bedroom,2.13,1,17544,United Kingdom
536544,2018-12-01,22748,Poppys Playhouse Kitchen,2.13,1,17544,United Kingdom
536544,2018-12-01,22755,Small Purple Babushka Notebook,1.75,3,17544,United Kingdom
536544,2018-12-01,22757,Large Red Babushka Notebook,1.88,3,17544,United Kingdom
536544,2018-12-01,22758,Large Purple Babushka Notebook,1.88,2,17544,United Kingdom
536544,2018-12-01,22759,Set Of 3 Notebooks In Parcel,2,3,17544,United Kingdom
536544,2018-12-01,22760,Tray Breakfast In Bed,5.32,1,17544,United Kingdom
536544,2018-12-01,22769,Chalkboard Kitchen Organiser,9.15,1,17544,United Kingdom
536544,2018-12-01,22791,T-Light Glass Fluted Antique,1.88,3,17544,United Kingdom
536544,2018-12-01,22792,Fluted Antique Candle Holder,1.75,2,17544,United Kingdom
536544,2018-12-01,22798,Antique Glass Dressing Table Pot,2.39,2,17544,United Kingdom
536544,2018-12-01,22812,Pack 3 Boxes Christmas Panettone,2.13,2,17544,United Kingdom
536544,2018-12-01,22813,Pack 3 Boxes Bird Panettone,2.13,1,17544,United Kingdom
536544,2018-12-01,22816,Card Motorbike Santa,1.63,4,17544,United Kingdom
536544,2018-12-01,22818,Card Christmas Village,1.63,6,17544,United Kingdom
536544,2018-12-01,22822,Cream Wall Planter Heart Shaped,3.41,1,17544,United Kingdom
536544,2018-12-01,22835,Hot Water Bottle I Am So Poorly,2.9,4,17544,United Kingdom
536544,2018-12-01,22837,Hot Water Bottle Babushka,2.9,1,17544,United Kingdom
536544,2018-12-01,22844,Vintage Cream Dog Food Container,4.05,1,17544,United Kingdom
536544,2018-12-01,22847,Bread Bin Diner Style Ivory,6.6,1,17544,United Kingdom
536544,2018-12-01,22862,Love Heart Napkin Box,2.77,1,17544,United Kingdom
536544,2018-12-01,22865,Hand Warmer Owl Design,2.13,1,17544,United Kingdom
536544,2018-12-01,22866,Hand Warmer Scotty Dog Design,2.13,4,17544,United Kingdom
536544,2018-12-01,22867,Hand Warmer Bird Design,2.13,4,17544,United Kingdom
536544,2018-12-01,22876,Number Tile Cottage Garden 8,2.13,1,17544,United Kingdom
536544,2018-12-01,22899,Childrens Apron Dolly Girl,2.13,2,17544,United Kingdom
536544,2018-12-01,22900,Set 2 Tea Towels I Love London,2.39,1,17544,United Kingdom
536544,2018-12-01,22906,12 Message Cards With Envelopes,2,2,17544,United Kingdom
536544,2018-12-01,22909,Set Of 20 Vintage Christmas Napkins,1.75,3,17544,United Kingdom
536544,2018-12-01,22910,Paper Chain Kit Vintage Christmas,2.39,4,17544,United Kingdom
536544,2018-12-01,22916,Herb Marker Thyme,1.75,1,17544,United Kingdom
536544,2018-12-01,22917,Herb Marker Rosemary,1.75,1,17544,United Kingdom
536544,2018-12-01,22918,Herb Marker Parsley,1.75,1,17544,United Kingdom
536544,2018-12-01,22919,Herb Marker Mint,1.75,1,17544,United Kingdom
536544,2018-12-01,22920,Herb Marker Basil,1.75,1,17544,United Kingdom
536544,2018-12-01,22921,Herb Marker Chives,1.75,1,17544,United Kingdom
536544,2018-12-01,22928,Yellow Giant Garden Thermometer,3.28,1,17544,United Kingdom
536544,2018-12-01,22940,Feltcraft Christmas Fairy,2.77,2,17544,United Kingdom
536544,2018-12-01,22945,Christmas Metal Tags Assorted,3.15,1,17544,United Kingdom
536544,2018-12-01,22948,Metal Decoration Naughty Children,2.52,2,17544,United Kingdom
536544,2018-12-01,22949,Set Of 36 Dolly Girl Paper Doilies,1.95,1,17544,United Kingdom
536544,2018-12-01,22951,60 Cake Cases Dolly Girl Design,1.69,2,17544,United Kingdom
536544,2018-12-01,22952,60 Cake Cases Vintage Christmas,1.69,1,17544,United Kingdom
536544,2018-12-01,22956,36 Foil Heart Cake Cases,2.13,1,17544,United Kingdom
536544,2018-12-01,22960,Jam Making Set With Jars,2.77,7,17544,United Kingdom
536544,2018-12-01,22961,Jam Making Set Printed,2,9,17544,United Kingdom
536544,2018-12-01,22962,Jam Jar With Pink Lid,1.75,4,17544,United Kingdom
536544,2018-12-01,22963,Jam Jar With Green Lid,1.75,1,17544,United Kingdom
536544,2018-12-01,22966,Gingerbread Man Cookie Cutter,1.88,3,17544,United Kingdom
536544,2018-12-01,22969,Homemade Jam Scented Candles,2,1,17544,United Kingdom
536544,2018-12-01,22972,Childrens Spaceboy Mug,2,1,17544,United Kingdom
536544,2018-12-01,22974,Childrens Dolly Girl Mug,2,3,17544,United Kingdom
536544,2018-12-01,22975,Spaceboy Childrens Egg Cup,1.88,2,17544,United Kingdom
536544,2018-12-01,22976,Circus Parade Childrens Egg Cup,1.88,1,17544,United Kingdom
536544,2018-12-01,22988,Soldiers Egg Cup,1.88,3,17544,United Kingdom
536544,2018-12-01,35095A,Blue Victorian Fabric Oval Box,1.63,2,17544,United Kingdom
536544,2018-12-01,35095B,Red Victorian Fabric Oval Box,1.63,1,17544,United Kingdom
536544,2018-12-01,35471D,Set Of 3 Bird Light Pink Feather,1.88,1,17544,United Kingdom
536544,2018-12-01,35598D,Pink/White Christmas Tree 60cm,1.88,1,17544,United Kingdom
536544,2018-12-01,35599D,Pink And White Christmas Tree 120cm,2.39,1,17544,United Kingdom
536544,2018-12-01,35610A,Pink Christmas Flock Droplet,1.88,1,17544,United Kingdom
536544,2018-12-01,35818P,Acrylic Jewel Icicle Pink,2,1,17544,United Kingdom
536544,2018-12-01,35957,Smallfolkart Bauble Christmas Dec,1.75,2,17544,United Kingdom
536544,2018-12-01,35961,Folkart Zinc Heart Christmas Dec,1.75,1,17544,United Kingdom
536544,2018-12-01,35971,Rose Folkart Heart Decorations,1.88,1,17544,United Kingdom
536544,2018-12-01,37370,Retro Coffee Mugs Assorted,3.92,1,17544,United Kingdom
536544,2018-12-01,37449,Ceramic Cake Stand + Hanging Cakes,4.68,1,17544,United Kingdom
536544,2018-12-01,37476,Condiment Tray 4 Bowls And 4 Spoons,4.3,1,17544,United Kingdom
536544,2018-12-01,47559B,Tea Time Oven Glove,1.88,2,17544,United Kingdom
536544,2018-12-01,47580,Tea Time Des Tea Cosy,2.26,1,17544,United Kingdom
536544,2018-12-01,47591B,Scotties Childrens Apron,1.75,2,17544,United Kingdom
536544,2018-12-01,47591D,Pink Fairy Cake Childrens Apron,2.13,1,17544,United Kingdom
536544,2018-12-01,47593B,Scottie Dogs Baby Bib,1.63,2,17544,United Kingdom
536544,2018-12-01,48188,Doormat Welcome Puppies,3.66,1,17544,United Kingdom
536544,2018-12-01,70007,Hi Tec Alpine Hand Warmer,2,5,17544,United Kingdom
536544,2018-12-01,71053,White Moroccan Metal Lantern,2.77,1,17544,United Kingdom
536544,2018-12-01,71459,Hanging Jam Jar T-Light Holders,1.75,8,17544,United Kingdom
536544,2018-12-01,72586,Set Of 6 Halloween Ghost T-Lights,1.63,1,17544,United Kingdom
536544,2018-12-01,72799E,Ivory Pillar Candle Silver Flock,2,2,17544,United Kingdom
536544,2018-12-01,72799F,Ivory Pillar Candle Gold Flock,2,2,17544,United Kingdom
536544,2018-12-01,72807A,Set/3 Rose Candle In Jewelled Box,2.77,1,17544,United Kingdom
536544,2018-12-01,72807B,Set/3 Ocean Scent Candle Jewel Box,2.77,1,17544,United Kingdom
536544,2018-12-01,72807C,Set/3 Vanilla Scented Candle In Box,2.77,1,17544,United Kingdom
536544,2018-12-01,72816,Set/3 Christmas Decoupage Candles,1.88,1,17544,United Kingdom
536544,2018-12-01,72817,Set Of 2 Christmas Decoupage Candle,1.75,2,17544,United Kingdom
536544,2018-12-01,79030D,Tumbler Baroque,3.41,1,17544,United Kingdom
536544,2018-12-01,79030G,Tumbler New England,3.41,1,17544,United Kingdom
536544,2018-12-01,79321,Chilli Lights,3.03,1,17544,United Kingdom
536544,2018-12-01,82551,Laundry 15c Metal Sign,1.88,1,17544,United Kingdom
536544,2018-12-01,82578,Kitchen Metal Sign,1.69,1,17544,United Kingdom
536544,2018-12-01,21171,Bathroom Metal Sign,1.69,1,17544,United Kingdom
536544,2018-12-01,82583,Hot Baths Metal Sign,2.13,1,17544,United Kingdom
536544,2018-12-01,82613A,Metal Sign Cupcake Single Hook,1.88,1,17544,United Kingdom
536544,2018-12-01,82613A,Metal Sign Cupcake Single Hook,1.88,1,17544,United Kingdom
536544,2018-12-01,82613A,Metal Sign Cupcake Single Hook,1.88,1,17544,United Kingdom
536544,2018-12-01,84029E,Red Woolly Hottie White Heart,2.64,1,17544,United Kingdom
536544,2018-12-01,84029G,Knitted Union Flag Hot Water Bottle,2.64,1,17544,United Kingdom
536544,2018-12-01,84031A,Charlie+Lola Red Hot Water Bottle,2.13,4,17544,United Kingdom
536544,2018-12-01,84031B,Charlie Lola Blue Hot Water Bottle,2.13,1,17544,United Kingdom
536544,2018-12-01,84032A,Charlie+Lola Pink Hot Water Bottle,2,8,17544,United Kingdom
536544,2018-12-01,84032B,Charlie + Lola Red Hot Water Bottle,2,4,17544,United Kingdom
536544,2018-12-01,84050,Pink Heart Shape Egg Frying Pan,2.13,3,17544,United Kingdom
536544,2018-12-01,84086C,Pink/Purple Retro Radio,2.13,1,17544,United Kingdom
536544,2018-12-01,84279B,Cherry Blossom Decorative Flask,2.77,1,17544,United Kingdom
536544,2018-12-01,84347,Rotating Silver Angels T-Light Hldr,2.26,4,17544,United Kingdom
536544,2018-12-01,84992,72 Sweetheart Fairy Cake Cases,1.69,1,17544,United Kingdom
536544,2018-12-01,85014B,Red Retrospot Umbrella,3.41,2,17544,United Kingdom
536544,2018-12-01,85015,Set Of 12 Vintage Postcard Set,1.88,1,17544,United Kingdom
536544,2018-12-01,85016,Set Of 6 Vintage Notelets Kit,1.88,2,17544,United Kingdom
536544,2018-12-01,85017A,Envelope 50 Romantic Images,1.63,1,17544,United Kingdom
536544,2018-12-01,85017B,Envelope 50 Blossom Images,1.63,1,17544,United Kingdom
536544,2018-12-01,85032D,Yuletide Images Gift Wrap Set,1.75,2,17544,United Kingdom
536544,2018-12-01,85039A,Set/4 Red Mini Rose Candle In Bowl,1.75,3,17544,United Kingdom
536544,2018-12-01,85048,15cm Christmas Glass Ball 20 Lights,4.05,1,17544,United Kingdom
536544,2018-12-01,85049E,Scandinavian Reds Ribbons,1.88,3,17544,United Kingdom
536544,2018-12-01,85049G,Chocolate Box Ribbons,1.88,1,17544,United Kingdom
536544,2018-12-01,85049H,Urban Black Ribbons,1.88,1,17544,United Kingdom
536544,2018-12-01,85064,Cream Sweetheart Letter Rack,3.15,1,17544,United Kingdom
536544,2018-12-01,85099B,Jumbo Bag Red Retrospot,2.13,1,17544,United Kingdom
536544,2018-12-01,85114B,Ivory Enchanted Forest Placemat,2,11,17544,United Kingdom
536544,2018-12-01,85116,Black Candelabra T-Light Holder,1.75,3,17544,United Kingdom
536544,2018-12-01,85123A,Cream Hanging Heart T-Light Holder,2.39,4,17544,United Kingdom
536544,2018-12-01,85127,Small Square Cut Glass Candlestick,3.03,2,17544,United Kingdom
536544,2018-12-01,85129D,Beaded Crystal Heart Pink Small,1.88,1,17544,United Kingdom
536544,2018-12-01,85131B,Beaded Crystal Heart Green On Stick,1.63,2,17544,United Kingdom
536544,2018-12-01,85132A,Charlie + Lola Biscuits Tins,2.77,2,17544,United Kingdom
536544,2018-12-01,85135B,Blue Dragonfly Helicopter,2.77,1,17544,United Kingdom
