TransactionNo,Date,ProductNo,ProductName,Price,Quantity,CustomerNo,Country
536984,2018-12-03,85232B,Set Of 3 Babushka Stacking Tins,2.24,7,17841,United Kingdom
536984,2018-12-03,21784,Shoe Shine Box,2.99,1,17841,United Kingdom
536985,2018-12-03,22423,Regency Cakestand 3 Tier,3.41,6,15373,United Kingdom
536985,2018-12-03,21843,Red Retrospot Cake Stand,3.14,6,15373,United Kingdom
536985,2018-12-03,21625,Vintage Union Jack Apron,2.54,3,15373,United Kingdom
536985,2018-12-03,22504,Cabin Bag Vintage Retrospot,5.99,1,15373,United Kingdom
536985,2018-12-03,21955,Doormat Union Jack Guns And Roses,2.69,4,15373,United Kingdom
536985,2018-12-03,22192,Blue Diner Wall Clock,2.78,2,15373,United Kingdom
536985,2018-12-03,22179,Set 10 Night Owl Lights,2.51,4,15373,United Kingdom
536985,2018-12-03,22191,Ivory Diner Wall Clock,2.78,2,15373,United Kingdom
536985,2018-12-03,22113,Grey Heart Hot Water Bottle,2.06,4,15373,United Kingdom
536985,2018-12-03,22087,Paper Bunting White Lace,1.94,6,15373,United Kingdom
536985,2018-12-03,22114,Hot Water Bottle Tea And Sympathy,2.09,4,15373,United Kingdom
536986,2018-12-03,21479,White Skull Hot Water Bottle,2.06,8,16140,United Kingdom
536986,2018-12-03,22492,Mini Paint Set Vintage,1.6,36,16140,United Kingdom
536986,2018-12-03,21509,Cowboys And Indians Birthday Card,1.56,12,16140,United Kingdom
536986,2018-12-03,22909,Set Of 20 Vintage Christmas Napkins,1.63,24,16140,United Kingdom
536986,2018-12-03,22694,Wicker Star,1.81,6,16140,United Kingdom
536986,2018-12-03,22409,Money Box Biscuits Design,1.69,12,16140,United Kingdom
536986,2018-12-03,22470,Heart Of Wicker Large,1.94,6,16140,United Kingdom
536987,2018-12-03,90128B,Blue Leaves And Beads Phone Charm,1.69,1,17198,United Kingdom
536987,2018-12-03,90195B,Black Gemstone Bracelet,2.84,1,17198,United Kingdom
536987,2018-12-03,90196B,Black Gemstone Necklace 45cm,3.41,1,17198,United Kingdom
536987,2018-12-03,90198B,Vintage Rose Bead Bracelet Black,2.14,1,17198,United Kingdom
536987,2018-12-03,90152B,Blue/Green Shell Necklace W Pendant,2.39,1,17198,United Kingdom
536987,2018-12-03,90151,Silver/Natural Shell Necklace,2.78,1,17198,United Kingdom
536987,2018-12-03,22482,Blue Tea Towel Classic Design,1.69,12,17198,United Kingdom
536987,2018-12-03,48184,Doormat English Rose,2.69,1,17198,United Kingdom
536987,2018-12-03,48194,Doormat Hearts,2.69,1,17198,United Kingdom
536987,2018-12-03,20685,Doormat Red Retrospot,2.69,2,17198,United Kingdom
536987,2018-12-03,21818,Glitter Heart Decoration,1.63,36,17198,United Kingdom
536987,2018-12-03,20661,Blue Polkadot Purse,1.94,1,17198,United Kingdom
536987,2018-12-03,20615,Blue Polkadot Passport Cover,1.81,1,17198,United Kingdom
536987,2018-12-03,20773,Blue Paisley Notebook,1.75,2,17198,United Kingdom
536987,2018-12-03,21850,Blue Diamante Pen In Gift Box,2.24,2,17198,United Kingdom
536987,2018-12-03,20652,Blue Polkadot Luggage Tag,1.69,2,17198,United Kingdom
536987,2018-12-03,85123A,Cream Hanging Heart T-Light Holder,1.94,6,17198,United Kingdom
536987,2018-12-03,22813,Pack 3 Boxes Bird Panettone,1.79,4,17198,United Kingdom
536987,2018-12-03,21845,Dairy Maid Stripe Mug,1.94,6,17198,United Kingdom
536987,2018-12-03,21034,Rex Cash+Carry Jumbo Shopper,1.64,2,17198,United Kingdom
536987,2018-12-03,22467,Gumball Coat Rack,1.88,2,17198,United Kingdom
536987,2018-12-03,22781,Gumball Magazine Rack,2.65,2,17198,United Kingdom
536987,2018-12-03,21623,Vintage Union Jack Memoboard,2.99,2,17198,United Kingdom
536987,2018-12-03,22304,Coffee Mug Blue Paisley Design,1.88,1,17198,United Kingdom
536987,2018-12-03,20967,Grey Floral Feltcraft Shoulder Bag,2.06,1,17198,United Kingdom
536987,2018-12-03,22398,Magnets Pack Of 4 Swallows,1.69,1,17198,United Kingdom
536987,2018-12-03,20854,Blue Patch Purse Pink Heart,1.75,1,17198,United Kingdom
536987,2018-12-03,22733,3d Traditional Christmas Stickers,1.69,1,17198,United Kingdom
536987,2018-12-03,84877D,Blue Round Compact Mirror,2.06,1,17198,United Kingdom
536987,2018-12-03,20657,Tropical Luggage Tag,1.69,1,17198,United Kingdom
536987,2018-12-03,16237,Sleeping Cat Erasers,1.53,1,17198,United Kingdom
536987,2018-12-03,22578,Wooden Star Christmas Scandinavian,1.63,1,17198,United Kingdom
536987,2018-12-03,47422,Assorted Monkey Suction Cup Hook,1.56,1,17198,United Kingdom
536987,2018-12-03,22292,Hanging Chick Yellow Decoration,1.72,1,17198,United Kingdom
536987,2018-12-03,22940,Feltcraft Christmas Fairy,2.14,1,17198,United Kingdom
536987,2018-12-03,10120,Doggy Rubber,1.53,2,17198,United Kingdom
536987,2018-12-03,20774,Green Fern Notebook,1.75,1,17198,United Kingdom
536987,2018-12-03,20773,Blue Paisley Notebook,1.75,3,17198,United Kingdom
536987,2018-12-03,22753,Small Yellow Babushka Notebook,1.63,1,17198,United Kingdom
536987,2018-12-03,22754,Small Red Babushka Notebook,1.63,1,17198,United Kingdom
536987,2018-12-03,22961,Jam Making Set Printed,1.72,1,17198,United Kingdom
536987,2018-12-03,21642,Assorted Tutti Frutti Pen,1.63,2,17198,United Kingdom
536987,2018-12-03,20658,Red Retrospot Luggage Tag,1.69,1,17198,United Kingdom
536987,2018-12-03,20982,12 Pencils Tall Tube Skulls,1.63,1,17198,United Kingdom
536987,2018-12-03,22651,Gentleman Shirt Repair Kit,1.63,1,17198,United Kingdom
536987,2018-12-03,85178,Victorian Sewing Kit,1.69,1,17198,United Kingdom
536987,2018-12-03,22396,Magnets Pack Of 4 Retro Photo,1.69,1,17198,United Kingdom
536987,2018-12-03,16238,Party Time Pencil Erasers,1.53,1,17198,United Kingdom
536987,2018-12-03,47503H,Ass Floral Print Spirit Level,1.79,1,17198,United Kingdom
536987,2018-12-03,72127,Columbian Candle Round,1.6,1,17198,United Kingdom
536987,2018-12-03,72127,Columbian Candle Round,1.63,1,17198,United Kingdom
536987,2018-12-03,72127,Columbian Candle Round,1.69,1,17198,United Kingdom
536987,2018-12-03,21928,Jumbo Bag Scandinavian Blue Paisley,1.79,1,17198,United Kingdom
536988,2018-12-03,22086,Paper Chain Kit 50S Christmas,1.94,2,17238,United Kingdom
536988,2018-12-03,21918,Set 12 Kids Colour Chalk Sticks,1.56,1,17238,United Kingdom
536988,2018-12-03,47343A,Fuschia Flower Purse With Beads,1.72,3,17238,United Kingdom
536988,2018-12-03,22142,Christmas Craft White Fairy,1.72,2,17238,United Kingdom
536988,2018-12-03,21098,Christmas Toilet Roll,1.69,1,17238,United Kingdom
536988,2018-12-03,22352,Lunch Box With Cutlery Retrospot,1.88,2,17238,United Kingdom
536988,2018-12-03,22865,Hand Warmer Owl Design,1.81,2,17238,United Kingdom
536988,2018-12-03,22632,Hand Warmer Red Retrospot,1.81,3,17238,United Kingdom
536988,2018-12-03,22144,Christmas Craft Little Friends,1.81,2,17238,United Kingdom
536988,2018-12-03,22964,3 Piece Spaceboy Cookie Cutter Set,1.81,3,17238,United Kingdom
536988,2018-12-03,22910,Paper Chain Kit Vintage Christmas,1.94,2,17238,United Kingdom
536988,2018-12-03,22966,Gingerbread Man Cookie Cutter,1.69,4,17238,United Kingdom
536988,2018-12-03,84380,Set Of 3 Butterfly Cookie Cutters,1.69,2,17238,United Kingdom
536988,2018-12-03,21479,White Skull Hot Water Bottle,2.06,1,17238,United Kingdom
536988,2018-12-03,22694,Wicker Star,1.81,1,17238,United Kingdom
536988,2018-12-03,22968,Rose Cottage Keepsake Box,2.99,2,17238,United Kingdom
536988,2018-12-03,22075,6 Ribbons Elegant Christmas,1.75,3,17238,United Kingdom
536988,2018-12-03,85049F,Baby Boom Ribbons,1.69,2,17238,United Kingdom
536988,2018-12-03,85049C,Romantic Pinks Ribbons,1.69,2,17238,United Kingdom
536988,2018-12-03,72802A,Rose Scent Candle In Jewelled Box,2.14,1,17238,United Kingdom
536988,2018-12-03,22748,Poppys Playhouse Kitchen,1.81,3,17238,United Kingdom
536988,2018-12-03,22745,Poppys Playhouse Bedroom,1.81,2,17238,United Kingdom
536988,2018-12-03,20967,Grey Floral Feltcraft Shoulder Bag,2.06,2,17238,United Kingdom
536988,2018-12-03,21499,Blue Polkadot Wrap,1.56,25,17238,United Kingdom
536988,2018-12-03,21623,Vintage Union Jack Memoboard,2.99,3,17238,United Kingdom
536988,2018-12-03,22746,Poppys Playhouse Livingroom,1.81,3,17238,United Kingdom
536988,2018-12-03,20749,Assorted Colour Mini Cases,2.69,1,17238,United Kingdom
536988,2018-12-03,20750,Red Retrospot Mini Cases,2.69,1,17238,United Kingdom
536988,2018-12-03,22617,Baking Set Spaceboy Design,2.24,2,17238,United Kingdom
536988,2018-12-03,22505,Memo Board Cottage Design,2.24,3,17238,United Kingdom
536988,2018-12-03,84558A,3d Dog Picture Playing Cards,1.94,3,17238,United Kingdom
536988,2018-12-03,84581,Dog Toy With Pink Crochet Skirt,2.06,1,17238,United Kingdom
536988,2018-12-03,84580,Mouse Toy With Pink T-Shirt,2.06,1,17238,United Kingdom
536988,2018-12-03,21481,Fawn Blue Hot Water Bottle,1.94,2,17238,United Kingdom
536988,2018-12-03,22837,Hot Water Bottle Babushka,2.2,4,17238,United Kingdom
536988,2018-12-03,22634,Childs Breakfast Set Spaceboy,2.99,1,17238,United Kingdom
536988,2018-12-03,21928,Jumbo Bag Scandinavian Blue Paisley,1.79,1,17238,United Kingdom
536988,2018-12-03,22411,Jumbo Shopper Vintage Red Paisley,1.79,1,17238,United Kingdom
536989,2018-12-03,85135B,Blue Dragonfly Helicopter,2.69,1,17238,United Kingdom
536989,2018-12-03,15056N,Edwardian Parasol Natural,2.39,1,17238,United Kingdom
536989,2018-12-03,72807B,Set/3 Ocean Scent Candle Jewel Box,2.14,2,17238,United Kingdom
536989,2018-12-03,72802B,Ocean Scent Candle In Jewelled Box,2.14,2,17238,United Kingdom
536989,2018-12-03,22750,Feltcraft Princess Lola Doll,2.06,1,17238,United Kingdom
536989,2018-12-03,22149,Feltcraft 6 Flower Friends,1.81,1,17238,United Kingdom
536989,2018-12-03,22150,3 Stripey Mice Feltcraft,1.79,1,17238,United Kingdom
536989,2018-12-03,21054,Nurses Bag Soft Toy,2.84,1,17238,United Kingdom
536989,2018-12-03,22505,Memo Board Cottage Design,2.24,1,17238,United Kingdom
536989,2018-12-03,22837,Hot Water Bottle Babushka,2.2,1,17238,United Kingdom
536989,2018-12-03,21479,White Skull Hot Water Bottle,2.06,1,17238,United Kingdom
536989,2018-12-03,21588,Retrospot Giant Tube Matches,1.88,1,17238,United Kingdom
536989,2018-12-03,21992,Vintage Paisley Stationery Set,1.94,1,17238,United Kingdom
536989,2018-12-03,21991,Bohemian Collage Stationery Set,1.94,1,17238,United Kingdom
536989,2018-12-03,22470,Heart Of Wicker Large,1.94,1,17238,United Kingdom
536989,2018-12-03,21485,Retrospot Heart Hot Water Bottle,2.24,2,17238,United Kingdom
536989,2018-12-03,22141,Christmas Craft Tree Top Angel,1.81,1,17238,United Kingdom
536989,2018-12-03,22618,Cooking Set Retrospot,2.99,1,17238,United Kingdom
536989,2018-12-03,22940,Feltcraft Christmas Fairy,2.14,2,17238,United Kingdom
536989,2018-12-03,21539,Red Retrospot Butter Dish,2.24,1,17238,United Kingdom
536989,2018-12-03,21931,Jumbo Storage Bag Suki,1.79,1,17238,United Kingdom
536990,2018-12-03,21992,Vintage Paisley Stationery Set,1.94,6,12793,Portugal
536990,2018-12-03,22383,Lunch Bag Suki Design,1.75,10,12793,Portugal
536990,2018-12-03,20728,Lunch Bag Cars Blue,1.75,14,12793,Portugal
536990,2018-12-03,20658,Red Retrospot Luggage Tag,1.69,12,12793,Portugal
536990,2018-12-03,20669,Red Heart Luggage Tag,1.69,12,12793,Portugal
536990,2018-12-03,20726,Lunch Bag Woodland,1.75,10,12793,Portugal
536992,2018-12-03,84032B,Charlie + Lola Red Hot Water Bottle,1.88,36,15769,United Kingdom
536993,2018-12-03,22470,Heart Of Wicker Large,1.94,2,14396,United Kingdom
536993,2018-12-03,84562A,Pink/White Ribbed Melamine Jug,2.69,1,14396,United Kingdom
536993,2018-12-03,21932,Scandinavian Paisley Picnic Bag,1.94,1,14396,United Kingdom
536993,2018-12-03,21936,Red Retrospot Picnic Bag,1.94,1,14396,United Kingdom
536993,2018-12-03,21933,Pink Vintage Paisley Picnic Bag,1.94,1,14396,United Kingdom
536993,2018-12-03,20726,Lunch Bag Woodland,1.75,1,14396,United Kingdom
536993,2018-12-03,22111,Scottie Dog Hot Water Bottle,2.24,1,14396,United Kingdom
536993,2018-12-03,21329,Dinosaurs Writing Set,1.75,1,14396,United Kingdom
536993,2018-12-03,21327,Skulls Writing Set,1.75,1,14396,United Kingdom
536993,2018-12-03,22837,Hot Water Bottle Babushka,2.2,1,14396,United Kingdom
536993,2018-12-03,20828,Glitter Butterfly Clips,1.88,1,14396,United Kingdom
536993,2018-12-03,22077,6 Ribbons Rustic Charm,1.75,1,14396,United Kingdom
536993,2018-12-03,21040,Modern Vintage Cotton Shopping Bag,1.88,1,14396,United Kingdom
536993,2018-12-03,21937,Strawberry Picnic Bag,1.94,1,14396,United Kingdom
536993,2018-12-03,22736,Ribbon Reel Making Snowmen,1.75,1,14396,United Kingdom
536993,2018-12-03,22739,Ribbon Reel Christmas Sock Bauble,1.75,1,14396,United Kingdom
536993,2018-12-03,22735,Ribbon Reel Socks And Mittens,1.75,1,14396,United Kingdom
536993,2018-12-03,22737,Ribbon Reel Christmas Present,1.75,1,14396,United Kingdom
536993,2018-12-03,22865,Hand Warmer Owl Design,1.81,1,14396,United Kingdom
536993,2018-12-03,22867,Hand Warmer Bird Design,1.81,1,14396,United Kingdom
536993,2018-12-03,21733,Red Hanging Heart T-Light Holder,1.94,1,14396,United Kingdom
536993,2018-12-03,85123A,Cream Hanging Heart T-Light Holder,1.94,1,14396,United Kingdom
536993,2018-12-03,22418,10 Colour Spaceboy Pen,1.63,2,14396,United Kingdom
536993,2018-12-03,22666,Recipe Box Pantry Yellow Design,1.94,1,14396,United Kingdom
536993,2018-12-03,21591,Cosy Hour Cigar Box Matches,1.69,3,14396,United Kingdom
536993,2018-12-03,22701,Pink Dog Bowl,1.94,1,14396,United Kingdom
536993,2018-12-03,22964,3 Piece Spaceboy Cookie Cutter Set,1.81,1,14396,United Kingdom
536993,2018-12-03,22866,Hand Warmer Scotty Dog Design,1.81,2,14396,United Kingdom
536993,2018-12-03,22359,Glass Jar Kings Choice,1.94,1,14396,United Kingdom
536993,2018-12-03,22361,Glass Jar Daisy Fresh Cotton Wool,1.94,1,14396,United Kingdom
536993,2018-12-03,22362,Glass Jar Peacock Bath Salts,1.94,1,14396,United Kingdom
536993,2018-12-03,82011C,Bathroom Scales Footprints In Sand,2.06,1,14396,United Kingdom
536993,2018-12-03,84865,New Baroque Black Photo Album,2.78,1,14396,United Kingdom
536993,2018-12-03,21955,Doormat Union Jack Guns And Roses,2.69,1,14396,United Kingdom
536994,2018-12-03,22072,Red Retrospot Tea Cup And Saucer,2.06,8,14898,United Kingdom
536994,2018-12-03,84880,White Wire Egg Holder,2.39,9,14898,United Kingdom
536994,2018-12-03,21781,Ma Campagne Cutlery Box,3.74,1,14898,United Kingdom
537022,2018-12-03,22791,T-Light Glass Fluted Antique,1.69,12,12725,Italy
537022,2018-12-03,21287,Scented Velvet Lounge Candle,1.69,12,12725,Italy
537022,2018-12-03,79337,Blue Flock Glass Candleholder,1.75,6,12725,Italy
537022,2018-12-03,85111,Silver Glitter Flower Votive Holder,1.69,12,12725,Italy
537022,2018-12-03,85038,6 Chocolate Love Heart T-Lights,1.81,6,12725,Italy
537022,2018-12-03,22809,Set Of 6 T-Lights Santa,1.94,6,12725,Italy
537022,2018-12-03,22810,Set Of 6 T-Lights Snowmen,1.94,6,12725,Italy
537022,2018-12-03,20956,Porcelain T-Light Holders Assorted,1.69,12,12725,Italy
537022,2018-12-03,22307,Gold Mug Bone China Tree Of Life,1.79,6,12725,Italy
537022,2018-12-03,85078,Scandinavian 3 Hearts Napkin Ring,1.6,24,12725,Italy
537022,2018-12-03,72802A,Rose Scent Candle In Jewelled Box,2.14,6,12725,Italy
537022,2018-12-03,72803A,Rose Scent Candle Jewelled Drawer,2.14,4,12725,Italy
537022,2018-12-03,72807C,Set/3 Vanilla Scented Candle In Box,2.14,4,12725,Italy
537022,2018-12-03,85034A,3 Gardenia Morris Boxed Candles,2.14,4,12725,Italy
537022,2018-12-03,85035C,Rose 3 Wick Morris Box Candle,2.14,4,12725,Italy
537022,2018-12-03,85036B,Chocolate 1 Wick Morris Box Candle,2.14,6,12725,Italy
537022,2018-12-03,85035B,Chocolate 3 Wick Morris Box Candle,2.14,4,12725,Italy
537022,2018-12-03,85035A,Gardenia 3 Wick Morris Boxed Candle,2.14,4,12725,Italy
537022,2018-12-03,85034C,3 Rose Morris Boxed Candles,2.14,4,12725,Italy
537022,2018-12-03,72741,Grand Chocolatecandle,1.72,9,12725,Italy
537022,2018-12-03,84614A,Pink Baroque Flock Candle Holder,2.39,2,12725,Italy
537022,2018-12-03,22697,Green Regency Teacup And Saucer,1.94,6,12725,Italy
537022,2018-12-03,84031A,Charlie+Lola Red Hot Water Bottle,2.2,3,12725,Italy
537023,2018-12-03,22509,Sewing Box Retrospot Design,4.04,1,16725,United Kingdom
537023,2018-12-03,85175,Cacti T-Light Candles,1.56,32,16725,United Kingdom
537023,2018-12-03,22471,Tv Dinner Tray Air Hostess,2.24,1,16725,United Kingdom
537023,2018-12-03,22072,Red Retrospot Tea Cup And Saucer,2.06,1,16725,United Kingdom
537023,2018-12-03,22457,Natural Slate Heart Chalkboard,1.94,1,16725,United Kingdom
537023,2018-12-03,22070,Small Red Retrospot Mug In Box,2.06,1,16725,United Kingdom
537023,2018-12-03,46000R,Polyester Filler Pad 45x30cm,1.72,1,16725,United Kingdom
537023,2018-12-03,22786,Cushion Cover Pink Union Jack,2.39,1,16725,United Kingdom
537023,2018-12-03,48187,Doormat New England,2.69,1,16725,United Kingdom
537023,2018-12-03,22660,Doormat I Love London,2.69,1,16725,United Kingdom
537023,2018-12-03,84836,Zinc Metal Heart Decoration,1.69,2,16725,United Kingdom
537023,2018-12-03,16237,Sleeping Cat Erasers,1.53,1,16725,United Kingdom
537023,2018-12-03,22686,French Blue Metal Door Sign No,1.69,1,16725,United Kingdom
537023,2018-12-03,22678,French Blue Metal Door Sign 3,1.69,1,16725,United Kingdom
537023,2018-12-03,22670,French Wc Sign Blue Metal,1.69,1,16725,United Kingdom
537023,2018-12-03,22672,French Bathroom Sign Blue Metal,1.75,1,16725,United Kingdom
537023,2018-12-03,21977,Pack Of 60 Pink Paisley Cake Cases,1.58,1,16725,United Kingdom
537023,2018-12-03,72741,Grand Chocolatecandle,1.72,2,16725,United Kingdom
537023,2018-12-03,22297,Heart Ivory Trellis Small,1.69,1,16725,United Kingdom
537023,2018-12-03,22865,Hand Warmer Owl Design,1.81,1,16725,United Kingdom
537023,2018-12-03,20724,Red Retrospot Charlotte Bag,1.63,2,16725,United Kingdom
537023,2018-12-03,22356,Charlotte Bag Pink Polkadot,1.63,1,16725,United Kingdom
537023,2018-12-03,82494L,Wooden Frame Antique White,1.94,1,16725,United Kingdom
537023,2018-12-03,22804,Pink Hanging Heart T-Light Holder,1.94,1,16725,United Kingdom
537023,2018-12-03,79321,Chilli Lights,2.24,6,16725,United Kingdom
537026,2018-12-03,84375,Set Of 20 Kids Cookie Cutters,1.81,12,12395,Belgium
537026,2018-12-03,21217,Red Retrospot Round Cake Tins,2.99,2,12395,Belgium
537026,2018-12-03,21212,Pack Of 72 Retrospot Cake Cases,1.56,120,12395,Belgium
537026,2018-12-03,21977,Pack Of 60 Pink Paisley Cake Cases,1.56,120,12395,Belgium
537026,2018-12-03,22417,Pack Of 60 Spaceboy Cake Cases,1.56,120,12395,Belgium
537026,2018-12-03,21975,Pack Of 60 Dinosaur Cake Cases,1.58,48,12395,Belgium
537026,2018-12-03,21976,Pack Of 60 Mushroom Cake Cases,1.58,48,12395,Belgium
537026,2018-12-03,22551,Plasters In Tin Spaceboy,1.75,12,12395,Belgium
537026,2018-12-03,85099B,Jumbo Bag Red Retrospot,1.79,10,12395,Belgium
537026,2018-12-03,22355,Charlotte Bag Suki Design,1.63,10,12395,Belgium
537026,2018-12-03,84992,72 Sweetheart Fairy Cake Cases,1.58,24,12395,Belgium
537030,2018-12-03,22587,Feltcraft Hairband Red And Blue,1.63,12,16455,United Kingdom
537030,2018-12-03,22586,Feltcraft Hairband Pink And Blue,1.63,12,16455,United Kingdom
537030,2018-12-03,22565,Feltcraft Hairbands Pink And White,1.63,12,16455,United Kingdom
537030,2018-12-03,22566,Feltcraft Hairband Pink And Purple,1.63,12,16455,United Kingdom
537030,2018-12-03,22150,3 Stripey Mice Feltcraft,1.79,12,16455,United Kingdom
537030,2018-12-03,22149,Feltcraft 6 Flower Friends,1.81,12,16455,United Kingdom
537030,2018-12-03,22147,Feltcraft Butterfly Hearts,1.72,12,16455,United Kingdom
537030,2018-12-03,20971,Pink Blue Felt Craft Trinket Box,1.69,12,16455,United Kingdom
537030,2018-12-03,20972,Pink Cream Felt Craft Trinket Box,1.69,12,16455,United Kingdom
537030,2018-12-03,22438,Balloon Art Make Your Own Flowers,1.79,10,16455,United Kingdom
537030,2018-12-03,22570,Feltcraft Cushion Rabbit,2.06,8,16455,United Kingdom
537030,2018-12-03,20970,Pink Floral Feltcraft Shoulder Bag,2.06,8,16455,United Kingdom
537030,2018-12-03,20969,Red Floral Feltcraft Shoulder Bag,2.06,8,16455,United Kingdom
537031,2018-12-03,22775,Purple Drawerknob Acrylic Edwardian,1.69,24,16455,United Kingdom
537031,2018-12-03,22774,Red Drawer Knob Acrylic Edwardian,1.69,24,16455,United Kingdom
537031,2018-12-03,22773,Green Drawer Knob Acrylic Edwardian,1.69,12,16455,United Kingdom
537031,2018-12-03,22772,Pink Drawer Knob Acrylic Edwardian,1.69,12,16455,United Kingdom
537031,2018-12-03,22771,Clear Drawer Knob Acrylic Edwardian,1.69,24,16455,United Kingdom
537031,2018-12-03,22805,Blue Drawer Knob Acrylic Edwardian,1.69,12,16455,United Kingdom
537034,2018-12-03,22867,Hand Warmer Bird Design,1.78,96,13081,United Kingdom
537034,2018-12-03,22866,Hand Warmer Scotty Dog Design,1.78,96,13081,United Kingdom
537034,2018-12-03,22865,Hand Warmer Owl Design,1.78,96,13081,United Kingdom
537034,2018-12-03,22633,Hand Warmer Union Jack,1.78,96,13081,United Kingdom
537034,2018-12-03,22616,Pack Of 12 London Tissues,1.54,48,13081,United Kingdom
537034,2018-12-03,22910,Paper Chain Kit Vintage Christmas,1.88,40,13081,United Kingdom
537034,2018-12-03,21094,Set/6 Red Spotty Paper Plates,1.63,36,13081,United Kingdom
537034,2018-12-03,84006,Magic Tree -Paper Flowers,1.63,36,13081,United Kingdom
537034,2018-12-03,22029,Spaceboy Birthday Card,1.56,24,13081,United Kingdom
537034,2018-12-03,21504,Skulls Greeting Card,1.56,24,13081,United Kingdom
537034,2018-12-03,22431,Watering Can Blue Elephant,1.79,24,13081,United Kingdom
537034,2018-12-03,21731,Red Toadstool Led Night Light,1.75,24,13081,United Kingdom
537034,2018-12-03,22553,Plasters In Tin Skulls,1.75,24,13081,United Kingdom
537034,2018-12-03,22418,10 Colour Spaceboy Pen,1.63,24,13081,United Kingdom
537034,2018-12-03,22197,Popcorn Holder,1.63,24,13081,United Kingdom
537034,2018-12-03,22662,Lunch Bag Dolly Girl Design,1.75,20,13081,United Kingdom
537034,2018-12-03,22629,Spaceboy Lunch Box,1.79,12,13081,United Kingdom
537034,2018-12-03,22738,Ribbon Reel Snowy Village,1.75,10,13081,United Kingdom
537034,2018-12-03,22732,3d Vintage Christmas Stickers,1.69,18,13081,United Kingdom
537034,2018-12-03,21086,Set/6 Red Spotty Paper Cups,1.6,12,13081,United Kingdom
537034,2018-12-03,22348,Tea Bag Plate Red Retrospot,1.63,12,13081,United Kingdom
537034,2018-12-03,20829,Glitter Hanging Butterfly String,1.81,8,13081,United Kingdom
537034,2018-12-03,84247G,Decoupage Greeting Card,1.56,12,13081,United Kingdom
537034,2018-12-03,20963,Apple Bath Sponge,1.69,20,13081,United Kingdom
537034,2018-12-03,21224,Set/4 Skull Badges,1.69,10,13081,United Kingdom
537034,2018-12-03,22090,Paper Bunting Retrospot,1.94,24,13081,United Kingdom
537034,2018-12-03,22433,Watering Can Green Dinosaur,1.79,12,13081,United Kingdom
537034,2018-12-03,21721,Candy Shop Sticker Sheet,1.63,24,13081,United Kingdom
537034,2018-12-03,21232,Strawberry Ceramic Trinket Pot,1.69,12,13081,United Kingdom
537034,2018-12-03,22133,Pink Love Heart Shape Cup,1.63,12,13081,United Kingdom
537034,2018-12-03,21559,Strawberry Lunch Box With Cutlery,1.88,6,13081,United Kingdom
537034,2018-12-03,22024,Rainy Ladies Birthday Card,1.56,12,13081,United Kingdom
537034,2018-12-03,21677,Hearts Stickers,1.63,12,13081,United Kingdom
537034,2018-12-03,84988,Set Of 72 Pink Heart Paper Doilies,1.72,12,13081,United Kingdom
537034,2018-12-03,22131,Food Container Set 3 Love Heart,1.79,12,13081,United Kingdom
537034,2018-12-03,20971,Pink Blue Felt Craft Trinket Box,1.69,12,13081,United Kingdom
537034,2018-12-03,20972,Pink Cream Felt Craft Trinket Box,1.69,12,13081,United Kingdom
537034,2018-12-03,21947,Set Of 6 Heart Chopsticks,1.69,12,13081,United Kingdom
537034,2018-12-03,22466,Fairy Tale Cottage Night Light,1.79,12,13081,United Kingdom
537034,2018-12-03,21726,Multi Hearts Stickers,1.63,12,13081,United Kingdom
537034,2018-12-03,21211,Set Of 72 Skull Paper Doilies,1.72,12,13081,United Kingdom
537034,2018-12-03,84029E,Red Woolly Hottie White Heart,2.06,12,13081,United Kingdom
537034,2018-12-03,84375,Set Of 20 Kids Cookie Cutters,1.81,12,13081,United Kingdom
537034,2018-12-03,21125,Set 6 Football Celebration Candles,1.69,12,13081,United Kingdom
537034,2018-12-03,21164,Home Sweet Home Metal Sign,1.94,12,13081,United Kingdom
537034,2018-12-03,21877,Home Sweet Home Mug,1.69,12,13081,United Kingdom
537034,2018-12-03,22111,Scottie Dog Hot Water Bottle,2.24,12,13081,United Kingdom
537034,2018-12-03,22434,Balloon Pump With 10 Balloons,1.79,8,13081,United Kingdom
537034,2018-12-03,21724,Panda And Bunnies Sticker Sheet,1.63,12,13081,United Kingdom
537034,2018-12-03,21429,Red Gingham Rose Jewellery Box,1.75,8,13081,United Kingdom
537034,2018-12-03,22569,Feltcraft Cushion Butterfly,2.06,12,13081,United Kingdom
537034,2018-12-03,84030E,English Rose Hot Water Bottle,2.14,12,13081,United Kingdom
537034,2018-12-03,22837,Hot Water Bottle Babushka,2.2,12,13081,United Kingdom
537034,2018-12-03,22142,Christmas Craft White Fairy,1.72,12,13081,United Kingdom
537034,2018-12-03,22748,Poppys Playhouse Kitchen,1.81,6,13081,United Kingdom
537034,2018-12-03,22780,Light Garland Butterfiles Pink,2.14,8,13081,United Kingdom
537034,2018-12-03,22940,Feltcraft Christmas Fairy,2.14,12,13081,United Kingdom
537034,2018-12-03,22198,Large Popcorn Holder,1.75,12,13081,United Kingdom
537034,2018-12-03,22745,Poppys Playhouse Bedroom,1.81,6,13081,United Kingdom
537034,2018-12-03,22746,Poppys Playhouse Livingroom,1.81,6,13081,United Kingdom
537034,2018-12-03,22747,Poppys Playhouse Bathroom,1.81,6,13081,United Kingdom
537034,2018-12-03,20676,Red Retrospot Bowl,1.69,8,13081,United Kingdom
537034,2018-12-03,21243,Pink Polkadot Plate,1.75,8,13081,United Kingdom
537034,2018-12-03,84997D,Childrens Cutlery Polkadot Pink,2.06,6,13081,United Kingdom
537034,2018-12-03,22432,Watering Can Pink Bunny,1.79,6,13081,United Kingdom
537034,2018-12-03,15060B,Fairy Cake Design Umbrella,2.06,4,13081,United Kingdom
537034,2018-12-03,22327,Round Snack Boxes Set Of 4 Skulls,1.94,6,13081,United Kingdom
537034,2018-12-03,21481,Fawn Blue Hot Water Bottle,1.94,12,13081,United Kingdom
537034,2018-12-03,22314,Office Mug Warmer Choc+Blue,1.94,6,13081,United Kingdom
537034,2018-12-03,22570,Feltcraft Cushion Rabbit,2.06,8,13081,United Kingdom
537034,2018-12-03,22200,Frying Pan Pink Polkadot,2.14,4,13081,United Kingdom
537034,2018-12-03,22568,Feltcraft Cushion Owl,2.06,8,13081,United Kingdom
537034,2018-12-03,21843,Red Retrospot Cake Stand,3.14,2,13081,United Kingdom
