TransactionNo,Date,ProductNo,ProductName,Price,Quantity,CustomerNo,Country
536741,2018-12-02,22144,Christmas Craft Little Friends,1.81,6,13117,United Kingdom
536741,2018-12-02,22652,Travel Sewing Kit,1.75,10,13117,United Kingdom
536741,2018-12-02,84945,Multi Colour Silver T-Light Holder,1.63,12,13117,United Kingdom
536742,2018-12-02,47504H,English Rose Spirit Level,1.79,1,16916,United Kingdom
536742,2018-12-02,85127,Small Square Cut Glass Candlestick,2.24,2,16916,United Kingdom
536742,2018-12-02,21472,Ladybird + Bee Raffia Food Cover,2.06,1,16916,United Kingdom
536742,2018-12-02,22196,Small Heart Measuring Spoons,1.63,1,16916,United Kingdom
536742,2018-12-02,22086,Paper Chain Kit 50S Christmas,1.94,1,16916,United Kingdom
536742,2018-12-02,84692,Box Of 24 Cocktail Parasols,1.56,1,16916,United Kingdom
536742,2018-12-02,84380,Set Of 3 Butterfly Cookie Cutters,1.69,1,16916,United Kingdom
536742,2018-12-02,20978,36 Pencils Tube Skulls,1.69,1,16916,United Kingdom
536742,2018-12-02,21833,Camouflage Led Torch,1.75,6,16916,United Kingdom
536742,2018-12-02,22553,Plasters In Tin Skulls,1.75,1,16916,United Kingdom
536742,2018-12-02,22451,Silk Purse Babushka Red,2,1,16916,United Kingdom
536742,2018-12-02,22450,Silk Purse Babushka Blue,2,1,16916,United Kingdom
536742,2018-12-02,10124G,Army Camo Bookcover Tape,1.56,5,16916,United Kingdom
536742,2018-12-02,84519B,Carrot Charlie+Lola Coaster Set,1.94,2,16916,United Kingdom
536742,2018-12-02,22941,Christmas Lights 10 Reindeer,2.78,1,16916,United Kingdom
536742,2018-12-02,22349,Dog Bowl Chasing Ball Design,2.06,1,16916,United Kingdom
536742,2018-12-02,21931,Jumbo Storage Bag Suki,1.79,1,16916,United Kingdom
536742,2018-12-02,22505,Memo Board Cottage Design,2.24,1,16916,United Kingdom
536742,2018-12-02,21922,Union Stripe With Fringe Hammock,2.69,1,16916,United Kingdom
536742,2018-12-02,21584,Retrospot Small Tube Matches,1.75,1,16916,United Kingdom
536742,2018-12-02,22312,Office Mug Warmer Polkadot,1.94,1,16916,United Kingdom
536742,2018-12-02,22822,Cream Wall Planter Heart Shaped,2.39,1,16916,United Kingdom
536742,2018-12-02,22514,Childs Garden Spade Blue,1.81,3,16916,United Kingdom
536742,2018-12-02,22988,Soldiers Egg Cup,1.69,2,16916,United Kingdom
536742,2018-12-02,22862,Love Heart Napkin Box,2.14,2,16916,United Kingdom
536742,2018-12-02,22973,Childrens Circus Parade Mug,1.75,1,16916,United Kingdom
536742,2018-12-02,22974,Childrens Dolly Girl Mug,1.75,1,16916,United Kingdom
536742,2018-12-02,22972,Childrens Spaceboy Mug,1.75,3,16916,United Kingdom
536742,2018-12-02,21213,Pack Of 72 Skull Cake Cases,1.58,1,16916,United Kingdom
536742,2018-12-02,22659,Lunch Box I Love London,1.79,2,16916,United Kingdom
536742,2018-12-02,22768,Family Photo Frame Cornice,2.99,1,16916,United Kingdom
536742,2018-12-02,21427,Skulls Storage Box Small,1.81,2,16916,United Kingdom
536742,2018-12-02,21504,Skulls Greeting Card,1.56,12,16916,United Kingdom
536742,2018-12-02,22292,Hanging Chick Yellow Decoration,1.72,1,16916,United Kingdom
536742,2018-12-02,22558,Clothes Pegs Retrospot Pack 24,1.72,2,16916,United Kingdom
536742,2018-12-02,22379,Recycling Bag Retrospot,1.81,1,16916,United Kingdom
536742,2018-12-02,22470,Heart Of Wicker Large,1.94,1,16916,United Kingdom
536742,2018-12-02,21211,Set Of 72 Skull Paper Doilies,1.72,1,16916,United Kingdom
536742,2018-12-02,22469,Heart Of Wicker Small,1.75,2,16916,United Kingdom
536742,2018-12-02,20978,36 Pencils Tube Skulls,1.69,3,16916,United Kingdom
536742,2018-12-02,21974,Set Of 36 Paisley Flower Doilies,1.72,1,16916,United Kingdom
536742,2018-12-02,20914,Set/5 Red Retrospot Lid Glass Bowls,1.94,1,16916,United Kingdom
536742,2018-12-02,22316,200 Bendy Skull Straws,1.69,1,16916,United Kingdom
536742,2018-12-02,22553,Plasters In Tin Skulls,1.75,1,16916,United Kingdom
536742,2018-12-02,22557,Plasters In Tin Vintage Paisley,1.75,1,16916,United Kingdom
536742,2018-12-02,22652,Travel Sewing Kit,1.75,1,16916,United Kingdom
536742,2018-12-02,22311,Office Mug Warmer Black+Silver,1.94,1,16916,United Kingdom
536742,2018-12-02,22465,Hanging Metal Star Lantern,1.75,12,16916,United Kingdom
536742,2018-12-02,84755,Colour Glass T-Light Holder Hanging,1.6,8,16916,United Kingdom
536742,2018-12-02,22666,Recipe Box Pantry Yellow Design,1.94,2,16916,United Kingdom
536743,2018-12-02,22045,Spaceboy Gift Wrap,1.56,25,17964,United Kingdom
536743,2018-12-02,90175C,Blue Glass Chunky Charm Bracelet,2.84,1,17964,United Kingdom
536743,2018-12-02,90180A,Black+White Necklace W Tassel,2.99,1,17964,United Kingdom
536743,2018-12-02,90178A,Amber Chunky Glass+Bead Necklace,3.29,1,17964,United Kingdom
536743,2018-12-02,22746,Poppys Playhouse Livingroom,1.81,1,17964,United Kingdom
536743,2018-12-02,22745,Poppys Playhouse Bedroom,1.81,1,17964,United Kingdom
536743,2018-12-02,22983,Card Billboard Font,1.56,12,17964,United Kingdom
536743,2018-12-02,21914,Blue Harmonica In Box,1.69,1,17964,United Kingdom
536743,2018-12-02,22986,Wrap Gingham Rose,1.56,25,17964,United Kingdom
536743,2018-12-02,21731,Red Toadstool Led Night Light,1.75,3,17964,United Kingdom
536743,2018-12-02,20984,12 Pencils Tall Tube Posy,1.63,2,17964,United Kingdom
536743,2018-12-02,22436,12 Coloured Party Balloons,1.6,10,17964,United Kingdom
536743,2018-12-02,21465,Pink Flower Crochet Food Cover,2.06,1,17964,United Kingdom
536743,2018-12-02,21470,Flower Vine Raffia Food Cover,2.06,1,17964,United Kingdom
536743,2018-12-02,22622,Box Of Vintage Alphabet Blocks,2.99,2,17964,United Kingdom
536743,2018-12-02,16012,Food/Drink Sponge Stickers,1.53,24,17964,United Kingdom
536743,2018-12-02,85135B,Blue Dragonfly Helicopter,2.69,1,17964,United Kingdom
536743,2018-12-02,22551,Plasters In Tin Spaceboy,1.75,1,17964,United Kingdom
536743,2018-12-02,85025C,Pink Heart Shape Photo Frame,1.75,2,17964,United Kingdom
536743,2018-12-02,21918,Set 12 Kids Colour Chalk Sticks,1.56,1,17964,United Kingdom
536743,2018-12-02,21851,Lilac Diamante Pen In Gift Box,2.24,1,17964,United Kingdom
536743,2018-12-02,21849,Silver Diamante Pen In Gift Box,2.24,1,17964,United Kingdom
536743,2018-12-02,22729,Alarm Clock Bakelike Orange,2.06,1,17964,United Kingdom
536743,2018-12-02,21889,Wooden Box Of Dominoes,1.69,1,17964,United Kingdom
536743,2018-12-02,85124B,Blue Juicy Fruit Photo Frame,1.88,1,17964,United Kingdom
536743,2018-12-02,85124C,Green Juicy Fruit Photo Frame,1.88,1,17964,United Kingdom
536743,2018-12-02,20828,Glitter Butterfly Clips,1.88,2,17964,United Kingdom
536743,2018-12-02,22554,Plasters In Tin Woodland Animals,1.75,2,17964,United Kingdom
536743,2018-12-02,22653,Button Box,1.79,2,17964,United Kingdom
536743,2018-12-02,21830,Assorted Creepy Crawlies,1.56,48,17964,United Kingdom
536743,2018-12-02,21623,Vintage Union Jack Memoboard,2.99,2,17964,United Kingdom
536743,2018-12-02,22785,Squarecushion Cover Pink Union Jack,2.51,2,17964,United Kingdom
536743,2018-12-02,22654,Deluxe Sewing Kit,2.39,5,17964,United Kingdom
536743,2018-12-02,84949,Silver Hanging T-Light Holder,1.75,6,17964,United Kingdom
536743,2018-12-02,22800,Antique Tall Swirlglass Trinket Pot,2.06,4,17964,United Kingdom
536744,2018-12-02,22898,Childrens Apron Apples Design,1.79,25,14466,United Kingdom
536744,2018-12-02,47591D,Pink Fairy Cake Childrens Apron,1.75,50,14466,United Kingdom
536744,2018-12-02,21156,Retrospot Childrens Apron,1.79,25,14466,United Kingdom
536744,2018-12-02,22367,Childrens Apron Spaceboy Design,1.79,10,14466,United Kingdom
536744,2018-12-02,22955,36 Foil Star Cake Cases,1.81,6,14466,United Kingdom
536744,2018-12-02,22956,36 Foil Heart Cake Cases,1.81,6,14466,United Kingdom
536744,2018-12-02,21625,Vintage Union Jack Apron,2.54,6,14466,United Kingdom
536744,2018-12-02,22423,Regency Cakestand 3 Tier,3.41,6,14466,United Kingdom
536744,2018-12-02,21843,Red Retrospot Cake Stand,3.14,2,14466,United Kingdom
536744,2018-12-02,22839,3 Tier Cake Tin Green And Cream,3.74,1,14466,United Kingdom
536745,2018-12-02,22738,Ribbon Reel Snowy Village,1.75,30,17235,United Kingdom
536745,2018-12-02,21430,Set/3 Red Gingham Rose Storage Box,2.06,8,17235,United Kingdom
536745,2018-12-02,85184C,Set 4 Valentine Decoupage Heart Box,1.94,12,17235,United Kingdom
536745,2018-12-02,20749,Assorted Colour Mini Cases,2.69,8,17235,United Kingdom
536745,2018-12-02,20750,Red Retrospot Mini Cases,2.69,8,17235,United Kingdom
536745,2018-12-02,22077,6 Ribbons Rustic Charm,1.75,24,17235,United Kingdom
536745,2018-12-02,22736,Ribbon Reel Making Snowmen,1.75,10,17235,United Kingdom
536745,2018-12-02,22737,Ribbon Reel Christmas Present,1.75,10,17235,United Kingdom
536745,2018-12-02,21428,Set3 Book Box Green Gingham Flower,2.14,4,17235,United Kingdom
536745,2018-12-02,85177,Basket Of Flowers Sewing Kit,1.63,12,17235,United Kingdom
536746,2018-12-02,22768,Family Photo Frame Cornice,2.99,2,16510,United Kingdom
536746,2018-12-02,22795,Sweetheart Recipe Book Stand,2.51,4,16510,United Kingdom
536746,2018-12-02,22914,Blue Coat Rack Paris Fashion,2.24,3,16510,United Kingdom
536746,2018-12-02,22969,Homemade Jam Scented Candles,1.72,12,16510,United Kingdom
536746,2018-12-02,21259,Victorian Sewing Box Small,2.39,2,16510,United Kingdom
536746,2018-12-02,21258,Victorian Sewing Box Large,3.41,1,16510,United Kingdom
536746,2018-12-02,84947,Antique Silver Tea Glass Engraved,1.69,12,16510,United Kingdom
536746,2018-12-02,84946,Antique Silver T-Light Glass,1.69,24,16510,United Kingdom
536746,2018-12-02,22169,Family Album White Picture Frame,2.78,2,16510,United Kingdom
536746,2018-12-02,22767,Triple Photo Frame Cornice,2.99,2,16510,United Kingdom
536746,2018-12-02,21587,Cosy Hour Giant Tube Matches,1.88,12,16510,United Kingdom
536746,2018-12-02,22082,Ribbon Reel Stripes Design,1.75,10,16510,United Kingdom
536746,2018-12-02,22604,Set Of 4 Napkin Charms Cutlery,1.88,6,16510,United Kingdom
536747,2018-12-02,16156S,Wrap Pink Fairy Cakes,1.56,25,17802,United Kingdom
536747,2018-12-02,85049G,Chocolate Box Ribbons,1.69,3,17802,United Kingdom
536747,2018-12-02,85049C,Romantic Pinks Ribbons,1.69,3,17802,United Kingdom
536747,2018-12-02,85049E,Scandinavian Reds Ribbons,1.69,3,17802,United Kingdom
536747,2018-12-02,85049F,Baby Boom Ribbons,1.69,3,17802,United Kingdom
536747,2018-12-02,85049A,Traditional Christmas Ribbons,1.69,3,17802,United Kingdom
536747,2018-12-02,85049H,Urban Black Ribbons,1.69,3,17802,United Kingdom
536747,2018-12-02,22866,Hand Warmer Scotty Dog Design,1.81,6,17802,United Kingdom
536747,2018-12-02,22865,Hand Warmer Owl Design,1.81,8,17802,United Kingdom
536747,2018-12-02,22834,Hand Warmer Babushka Design,1.81,6,17802,United Kingdom
536747,2018-12-02,22633,Hand Warmer Union Jack,1.81,6,17802,United Kingdom
536747,2018-12-02,22632,Hand Warmer Red Retrospot,1.81,6,17802,United Kingdom
536748,2018-12-02,84945,Multi Colour Silver T-Light Holder,1.63,12,15107,United Kingdom
536748,2018-12-02,22191,Ivory Diner Wall Clock,2.78,6,15107,United Kingdom
536748,2018-12-02,72760B,Vintage Cream 3 Basket Cake Stand,2.99,2,15107,United Kingdom
536748,2018-12-02,22634,Childs Breakfast Set Spaceboy,2.99,2,15107,United Kingdom
536748,2018-12-02,22426,Enamel Wash Bowl Cream,2.06,4,15107,United Kingdom
536749,2018-12-02,84029G,Knitted Union Flag Hot Water Bottle,2.06,1,17976,United Kingdom
536749,2018-12-02,20975,12 Pencils Small Tube Red Retrospot,1.6,1,17976,United Kingdom
536749,2018-12-02,84029E,Red Woolly Hottie White Heart,2.06,1,17976,United Kingdom
536749,2018-12-02,22190,Local Cafe Mug,1.81,1,17976,United Kingdom
536749,2018-12-02,90082D,Diamante Bow Brooch Black Colour,2.45,4,17976,United Kingdom
536749,2018-12-02,90082A,Diamante Bow Brooch Green Colour,2.45,5,17976,United Kingdom
536749,2018-12-02,90082B,Diamante Bow Brooch Red Colour,2.45,5,17976,United Kingdom
536749,2018-12-02,90081A,Lily Brooch Amethyst Colour,2.24,1,17976,United Kingdom
536749,2018-12-02,90204,Pair Of Enamel Butterfly Hairclip,2,1,17976,United Kingdom
536749,2018-12-02,90185B,Amethyst Diamante Expandable Ring,2.14,1,17976,United Kingdom
536749,2018-12-02,90185C,Black Diamante Expandable Ring,2.14,1,17976,United Kingdom
536749,2018-12-02,90195A,Purple Gemstone Bracelet,2.84,1,17976,United Kingdom
536749,2018-12-02,90195B,Black Gemstone Bracelet,2.84,1,17976,United Kingdom
536749,2018-12-02,90196A,Purple Gemstone Necklace 45cm,3.41,1,17976,United Kingdom
536749,2018-12-02,90199A,5 Strand Glass Necklace Black,2.45,2,17976,United Kingdom
536749,2018-12-02,90177C,Drop Diamante Earrings Crystal,1.94,1,17976,United Kingdom
536749,2018-12-02,90186A,Amethyst Hoop Earring Floral Leaf,1.94,1,17976,United Kingdom
536749,2018-12-02,22379,Recycling Bag Retrospot,1.81,1,17976,United Kingdom
536749,2018-12-02,20894,Hanging Bauble T-Light Holder Large,1.94,3,17976,United Kingdom
536749,2018-12-02,85106,Cut Glass Hexagon T-Light Holder,1.88,2,17976,United Kingdom
536749,2018-12-02,35271S,Gold Print Paper Bag,1.53,5,17976,United Kingdom
536749,2018-12-02,22480,Red Tea Towel Classic Design,1.69,4,17976,United Kingdom
536749,2018-12-02,21415,Clam Shell Small,1.81,2,17976,United Kingdom
536749,2018-12-02,20679,Edwardian Parasol Red,2.39,2,17976,United Kingdom
536749,2018-12-02,21034,Rex Cash+Carry Jumbo Shopper,1.64,3,17976,United Kingdom
536749,2018-12-02,85106,Cut Glass Hexagon T-Light Holder,1.88,2,17976,United Kingdom
536749,2018-12-02,21415,Clam Shell Small,1.81,2,17976,United Kingdom
536749,2018-12-02,22752,Set 7 Babushka Nesting Boxes,2.78,1,17976,United Kingdom
536749,2018-12-02,22441,Grow Your Own Basil In Enamel Mug,1.81,1,17976,United Kingdom
536749,2018-12-02,21710,Folding Umbrella Pinkwhite Polkadot,2.24,1,17976,United Kingdom
536749,2018-12-02,22174,Photo Cube,1.75,2,17976,United Kingdom
536749,2018-12-02,21212,Pack Of 72 Retrospot Cake Cases,1.58,2,17976,United Kingdom
536749,2018-12-02,22943,Christmas Lights 10 Vintage Baubles,2.24,1,17976,United Kingdom
536749,2018-12-02,21416,Clam Shell Large,2.06,1,17976,United Kingdom
536749,2018-12-02,22750,Feltcraft Princess Lola Doll,2.06,1,17976,United Kingdom
536749,2018-12-02,21417,Cockle Shell Dish,1.81,1,17976,United Kingdom
536749,2018-12-02,22371,Airline Bag Vintage Tokyo 78,2.14,1,17976,United Kingdom
536749,2018-12-02,22174,Photo Cube,1.75,2,17976,United Kingdom
536749,2018-12-02,22343,Party Pizza Dish Red Retrospot,1.63,6,17976,United Kingdom
536749,2018-12-02,22474,Spaceboy Tv Dinner Tray,2.24,1,17976,United Kingdom
536749,2018-12-02,20969,Red Floral Feltcraft Shoulder Bag,2.06,1,17976,United Kingdom
536749,2018-12-02,22371,Airline Bag Vintage Tokyo 78,2.14,2,17976,United Kingdom
536749,2018-12-02,22472,Tv Dinner Tray Dolly Girl,2.24,1,17976,United Kingdom
536749,2018-12-02,15056N,Edwardian Parasol Natural,2.39,1,17976,United Kingdom
536749,2018-12-02,21154,Red Retrospot Oven Glove,1.69,1,17976,United Kingdom
536749,2018-12-02,84347,Rotating Silver Angels T-Light Hldr,1.88,1,17976,United Kingdom
536749,2018-12-02,22441,Grow Your Own Basil In Enamel Mug,1.81,1,17976,United Kingdom
536749,2018-12-02,18097A,Pink Tall Porcelain T-Light Holder,1.88,1,17976,United Kingdom
536749,2018-12-02,18097C,White Tall Porcelain T-Light Holder,1.88,1,17976,United Kingdom
536749,2018-12-02,22472,Tv Dinner Tray Dolly Girl,2.24,1,17976,United Kingdom
536749,2018-12-02,22866,Hand Warmer Scotty Dog Design,1.81,1,17976,United Kingdom
536749,2018-12-02,21415,Clam Shell Small,1.81,2,17976,United Kingdom
536749,2018-12-02,22867,Hand Warmer Bird Design,1.81,1,17976,United Kingdom
536749,2018-12-02,22633,Hand Warmer Union Jack,1.81,2,17976,United Kingdom
536749,2018-12-02,22667,Recipe Box Retrospot,1.94,1,17976,United Kingdom
536749,2018-12-02,20914,Set/5 Red Retrospot Lid Glass Bowls,1.94,1,17976,United Kingdom
536749,2018-12-02,21429,Red Gingham Rose Jewellery Box,1.75,2,17976,United Kingdom
536749,2018-12-02,84879,Assorted Colour Bird Ornament,1.75,1,17976,United Kingdom
536749,2018-12-02,85123A,Cream Hanging Heart T-Light Holder,1.94,1,17976,United Kingdom
536749,2018-12-02,22900,Set 2 Tea Towels I Love London,1.94,1,17976,United Kingdom
536749,2018-12-02,22174,Photo Cube,1.75,2,17976,United Kingdom
536749,2018-12-02,22664,Toy Tidy Dolly Girl Design,1.81,1,17976,United Kingdom
536749,2018-12-02,22371,Airline Bag Vintage Tokyo 78,2.14,1,17976,United Kingdom
536749,2018-12-02,20967,Grey Floral Feltcraft Shoulder Bag,2.06,1,17976,United Kingdom
536749,2018-12-02,22569,Feltcraft Cushion Butterfly,2.06,1,17976,United Kingdom
536750,2018-12-02,85123A,Cream Hanging Heart T-Light Holder,1.88,12,17850,United Kingdom
536750,2018-12-02,71053,White Moroccan Metal Lantern,2.01,12,17850,United Kingdom
536750,2018-12-02,84406B,Cream Cupid Hearts Coat Hanger,1.91,6,17850,United Kingdom
536750,2018-12-02,20679,Edwardian Parasol Red,2.24,6,17850,United Kingdom
536750,2018-12-02,37370,Retro Coffee Mugs Assorted,1.66,6,17850,United Kingdom
536750,2018-12-02,21871,Save The Planet Mug,1.66,6,17850,United Kingdom
536750,2018-12-02,21071,Vintage Billboard Drink Me Mug,1.66,6,17850,United Kingdom
536750,2018-12-02,21068,Vintage Billboard Love/Hate Mug,1.66,6,17850,United Kingdom
536750,2018-12-02,82483,Wood 2 Drawer Cabinet White Finish,2.24,4,17850,United Kingdom
536750,2018-12-02,82486,3 Drawer Antique White Wood Cabinet,2.54,4,17850,United Kingdom
536750,2018-12-02,82482,Wooden Picture Frame White Finish,1.81,6,17850,United Kingdom
536750,2018-12-02,82494L,Wooden Frame Antique White,1.88,6,17850,United Kingdom
536750,2018-12-02,22411,Jumbo Shopper Vintage Red Paisley,1.75,6,17850,United Kingdom
536750,2018-12-02,84029G,Knitted Union Flag Hot Water Bottle,2.01,6,17850,United Kingdom
536750,2018-12-02,84029E,Red Woolly Hottie White Heart,2.01,6,17850,United Kingdom
536750,2018-12-02,22752,Set 7 Babushka Nesting Boxes,2.65,4,17850,United Kingdom
536750,2018-12-02,22803,Ivory Embroidered Quilt,6.86,2,17850,United Kingdom
536750,2018-12-02,21730,Glass Star Frosted T-Light Holder,2.14,8,17850,United Kingdom
536751,2018-12-02,22632,Hand Warmer Red Retrospot,1.78,6,17850,United Kingdom
536751,2018-12-02,22633,Hand Warmer Union Jack,1.78,6,17850,United Kingdom
536752,2018-12-02,85123A,Cream Hanging Heart T-Light Holder,1.88,6,17850,United Kingdom
536752,2018-12-02,71053,White Moroccan Metal Lantern,2.01,6,17850,United Kingdom
536752,2018-12-02,84406B,Cream Cupid Hearts Coat Hanger,1.91,6,17850,United Kingdom
536752,2018-12-02,20679,Edwardian Parasol Red,2.24,6,17850,United Kingdom
536752,2018-12-02,37370,Retro Coffee Mugs Assorted,1.66,6,17850,United Kingdom
536752,2018-12-02,21871,Save The Planet Mug,1.66,6,17850,United Kingdom
536752,2018-12-02,21071,Vintage Billboard Drink Me Mug,1.66,6,17850,United Kingdom
536752,2018-12-02,21068,Vintage Billboard Love/Hate Mug,1.66,6,17850,United Kingdom
536752,2018-12-02,82483,Wood 2 Drawer Cabinet White Finish,2.24,4,17850,United Kingdom
536752,2018-12-02,82486,3 Drawer Antique White Wood Cabinet,2.54,4,17850,United Kingdom
536752,2018-12-02,82482,Wooden Picture Frame White Finish,1.81,6,17850,United Kingdom
536752,2018-12-02,82494L,Wooden Frame Antique White,1.88,6,17850,United Kingdom
536752,2018-12-02,22411,Jumbo Shopper Vintage Red Paisley,1.75,6,17850,United Kingdom
536752,2018-12-02,84029G,Knitted Union Flag Hot Water Bottle,2.01,6,17850,United Kingdom
536752,2018-12-02,84029E,Red Woolly Hottie White Heart,2.01,6,17850,United Kingdom
536752,2018-12-02,22752,Set 7 Babushka Nesting Boxes,2.65,4,17850,United Kingdom
536752,2018-12-02,22803,Ivory Embroidered Quilt,6.86,2,17850,United Kingdom
536752,2018-12-02,21730,Glass Star Frosted T-Light Holder,2.14,6,17850,United Kingdom
536753,2018-12-02,22632,Hand Warmer Red Retrospot,1.78,6,17850,United Kingdom
536753,2018-12-02,22633,Hand Warmer Union Jack,1.78,6,17850,United Kingdom
536754,2018-12-02,22988,Soldiers Egg Cup,1.69,2,14449,United Kingdom
536754,2018-12-02,22975,Spaceboy Childrens Egg Cup,1.69,2,14449,United Kingdom
536754,2018-12-02,22976,Circus Parade Childrens Egg Cup,1.69,2,14449,United Kingdom
536754,2018-12-02,22977,Dolly Girl Childrens Egg Cup,1.69,2,14449,United Kingdom
536754,2018-12-02,21137,Black Record Cover Frame,2.06,1,14449,United Kingdom
536754,2018-12-02,22470,Heart Of Wicker Large,1.94,4,14449,United Kingdom
536754,2018-12-02,84754,S/15 Silver Glass Baubles In Bag,1.69,1,14449,United Kingdom
536754,2018-12-02,22296,Heart Ivory Trellis Large,1.75,5,14449,United Kingdom
536754,2018-12-02,21899,Garage Key Fob,1.6,4,14449,United Kingdom
536754,2018-12-02,22972,Childrens Spaceboy Mug,1.75,2,14449,United Kingdom
536754,2018-12-02,22335,Heart Decoration Painted Zinc,1.6,10,14449,United Kingdom
536754,2018-12-02,21911,Garden Metal Sign,1.75,1,14449,United Kingdom
536754,2018-12-02,21902,Key Fob Front Door,1.6,4,14449,United Kingdom
536754,2018-12-02,21901,Key Fob Back Door,1.6,4,14449,United Kingdom
536754,2018-12-02,21948,Set Of 6 Cake Chopsticks,1.69,1,14449,United Kingdom
536754,2018-12-02,21949,Set Of 6 Strawberry Chopsticks,1.69,1,14449,United Kingdom
536754,2018-12-02,22558,Clothes Pegs Retrospot Pack 24,1.72,1,14449,United Kingdom
536754,2018-12-02,20759,Chrysanthemum Pocket Book,1.63,1,14449,United Kingdom
536754,2018-12-02,20760,Garden Path Pocket Book,1.63,1,14449,United Kingdom
536754,2018-12-02,20757,Red Daisy Pocket Book,1.63,1,14449,United Kingdom
536754,2018-12-02,20755,Blue Paisley Pocket Book,1.63,1,14449,United Kingdom
536754,2018-12-02,22418,10 Colour Spaceboy Pen,1.63,12,14449,United Kingdom
536754,2018-12-02,20981,12 Pencils Tall Tube Woodland,1.63,3,14449,United Kingdom
536754,2018-12-02,22652,Travel Sewing Kit,1.75,2,14449,United Kingdom
536754,2018-12-02,22553,Plasters In Tin Skulls,1.75,1,14449,United Kingdom
536754,2018-12-02,22953,Birthday Party Cordon Barrier Tape,1.69,1,14449,United Kingdom
536754,2018-12-02,21544,Skulls Water Transfer Tattoos,1.63,10,14449,United Kingdom
536754,2018-12-02,22198,Large Popcorn Holder,1.75,2,14449,United Kingdom
536754,2018-12-02,22197,Popcorn Holder,1.63,3,14449,United Kingdom
536754,2018-12-02,20974,12 Pencils Small Tube Skull,1.6,6,14449,United Kingdom
536754,2018-12-02,20967,Grey Floral Feltcraft Shoulder Bag,2.06,2,14449,United Kingdom
536754,2018-12-02,22570,Feltcraft Cushion Rabbit,2.06,1,14449,United Kingdom
536754,2018-12-02,22274,Feltcraft Doll Emily,1.94,3,14449,United Kingdom
536754,2018-12-02,22743,Make Your Own Flowerpower Card Kit,1.94,1,14449,United Kingdom
536754,2018-12-02,20971,Pink Blue Felt Craft Trinket Box,1.69,3,14449,United Kingdom
536754,2018-12-02,85185D,Frog Sock Puppet,1.94,1,14449,United Kingdom
536754,2018-12-02,85185B,Pink Horse Sock Puppet Kit,1.94,1,14449,United Kingdom
536754,2018-12-02,22150,3 Stripey Mice Feltcraft,1.79,2,14449,United Kingdom
536754,2018-12-02,22147,Feltcraft Butterfly Hearts,1.72,4,14449,United Kingdom
536754,2018-12-02,22088,Paper Bunting Coloured Lace,1.94,2,14449,United Kingdom
536754,2018-12-02,22384,Lunch Bag Pink Polkadot,1.75,3,14449,United Kingdom
536754,2018-12-02,20727,Lunch Bag Black Skull,1.75,3,14449,United Kingdom
536754,2018-12-02,22867,Hand Warmer Bird Design,1.81,3,14449,United Kingdom
536754,2018-12-02,22834,Hand Warmer Babushka Design,1.81,5,14449,United Kingdom
536754,2018-12-02,22633,Hand Warmer Union Jack,1.81,4,14449,United Kingdom
536754,2018-12-02,22383,Lunch Bag Suki Design,1.75,5,14449,United Kingdom
536754,2018-12-02,20726,Lunch Bag Woodland,1.75,3,14449,United Kingdom
536754,2018-12-02,22328,Round Snack Boxes Set Of 4 Fruits,1.94,1,14449,United Kingdom
536754,2018-12-02,22326,Round Snack Boxes Set Of4 Woodland,1.94,2,14449,United Kingdom
536754,2018-12-02,22327,Round Snack Boxes Set Of 4 Skulls,1.94,2,14449,United Kingdom
536759,2018-12-02,48111,Doormat 3 Smiley Cats,2.69,4,16781,United Kingdom
536759,2018-12-02,82484,Wood Black Board Ant White Finish,2.47,3,16781,United Kingdom
536759,2018-12-02,22296,Heart Ivory Trellis Large,1.75,12,16781,United Kingdom
536759,2018-12-02,22183,Cake Stand Victorian Filigree Med,2.51,3,16781,United Kingdom
536759,2018-12-02,79164,Black Wine Glass,1.75,12,16781,United Kingdom
536759,2018-12-02,84683,Classical Rose Candlestand,1.69,24,16781,United Kingdom
536759,2018-12-02,82486,3 Drawer Antique White Wood Cabinet,2.69,2,16781,United Kingdom
536759,2018-12-02,21781,Ma Campagne Cutlery Box,3.74,1,16781,United Kingdom
536759,2018-12-02,21745,Gaolers Keys Decorative Garden,2.06,4,16781,United Kingdom
536759,2018-12-02,21257,Victorian Sewing Box Medium,2.69,2,16781,United Kingdom
536759,2018-12-02,82494L,Wooden Frame Antique White,1.94,6,16781,United Kingdom
536759,2018-12-02,79163,Black Champagne Glass,1.75,12,16781,United Kingdom
536759,2018-12-02,21844,Red Retrospot Mug,1.94,6,16781,United Kingdom
536759,2018-12-02,20828,Glitter Butterfly Clips,1.88,6,16781,United Kingdom
536759,2018-12-02,22924,Fridge Magnets La Vie En Rose,1.63,12,16781,United Kingdom
536759,2018-12-02,22928,Yellow Giant Garden Thermometer,2.39,2,16781,United Kingdom
536759,2018-12-02,48185,Doormat Fairy Cake,2.69,2,16781,United Kingdom
536761,2018-12-02,21116,Owl Doorstop,2.24,3,13491,United Kingdom
536761,2018-12-02,21155,Red Retrospot Peg Bag,1.81,6,13491,United Kingdom
536761,2018-12-02,15060B,Fairy Cake Design Umbrella,2.06,4,13491,United Kingdom
536761,2018-12-02,47591D,Pink Fairy Cake Childrens Apron,1.79,8,13491,United Kingdom
536761,2018-12-02,21217,Red Retrospot Round Cake Tins,2.99,1,13491,United Kingdom
536761,2018-12-02,21232,Strawberry Ceramic Trinket Pot,1.69,12,13491,United Kingdom
536761,2018-12-02,21527,Red Retrospot Traditional Teapot,2.69,2,13491,United Kingdom
536762,2018-12-02,20972,Pink Cream Felt Craft Trinket Box,1.69,12,16186,United Kingdom
536762,2018-12-02,85014A,Black/Blue Polkadot Umbrella,2.39,3,16186,United Kingdom
536762,2018-12-02,21232,Strawberry Ceramic Trinket Pot,1.69,12,16186,United Kingdom
536762,2018-12-02,20971,Pink Blue Felt Craft Trinket Box,1.69,12,16186,United Kingdom
536762,2018-12-02,22961,Jam Making Set Printed,1.72,12,16186,United Kingdom
536762,2018-12-02,20974,12 Pencils Small Tube Skull,1.6,24,16186,United Kingdom
536762,2018-12-02,85014B,Red Retrospot Umbrella,2.39,3,16186,United Kingdom
536762,2018-12-02,22174,Photo Cube,1.75,12,16186,United Kingdom
